Speaker,Headline,Summary,Author,News Source,Published,Tags,URL,YearMonth,Month,Week,Full_Text,Clean_Text,Text_Length,Dominant_Topic,Dominant_Topic_Label,Topic_Confidence,Topic_0_Weight,Topic_1_Weight,Topic_2_Weight,Topic_3_Weight,Topic_4_Weight,Topic_5_Weight,Topic_6_Weight
Modi,PM Modi's Lok Sabha address cancelled as Lower House adjourned amid Oppn uproar - The Economic Times,PM Modi's Lok Sabha address cancelled as Lower House adjourned amid Oppn uproar The Economic Times,,The Economic Times,2026-02-04 08:00:00,,https://news.google.com/rss/articles/CBMi7gFBVV95cUxQdUVBQlNoV3BteEZHVlJlQ0lqSWl4YjNab0JLNzVyS0NnNG93Si1CWk9fcDdyZDctQTZSQngxLUpMV0ZzMDBtRkNiOGlzS185Z04zOFhaOEhjZmk5ejRCZFpKUWk3ZEJUaEhEaWZQNGh4NzhmLXNQWTBucGUwUTVQQ0dubVJ1TjR3aWNEeDM3NGxKMHBESnhXbV9SZ2JpcklwTGdhaDJyeUpkaERHd0NRMWtyY2FTRUNNYkZ6NWY2WGRuXzlKSVc1aDVEakE2QmZTaHdiOUNuV2E0SnV5MFhQTkJWc0QtMzlwUUlQQkJn0gHzAUFVX3lxTE1EaU84dHRLQUFwQ0MwTThrSkJoT05jZWVnY09YQUF1Q3B1bFdoYXhxSWNWbl9ISkhlMzhnOGk2dnhsb0lRUWRMTk55RXQ5SGNMQkc4YXlEejhLQUpfOVJwcjdsSGRmQWhiTVZhMW9MTUtxRlctQjFNZzUteVo3eWFsZHdld3NTMTBLUlotbnFtb3dfRDZwbEJ3VlF2LVBwVm05Nk1MWXFyVUFYQkV5ZTVYLVFBQktoNzBMUmh3R19sbU5jcGNTVWNYbnlpQnI0MVFDYW1kaVdDcTJIU0xzTkExYUZGZ2hYMEFuOUpzalplUVU3TQ?oc=5,2026-02,February,6,PM Modi's Lok Sabha address cancelled as Lower House adjourned amid Oppn uproar - The Economic Times PM Modi's Lok Sabha address cancelled as Lower House adjourned amid Oppn uproar The Economic Times,lok sabha address cancelled lower house adjourned amid oppn uproar economic lok sabha address cancelled lower house adjourned amid oppn uproar economic,22,1,Topic 2: sabha / rajya / rajya sabha,0.18729624014553692,0.003672773624817231,0.18729624014553692,0.022383607536461212,0.0,0.07330034764263477,0.0,0.0
Modi,"‘As I said, PM Modi is scared…,’ says Rahul after Lok Sabha adjourned ahead of PM speech - theprint.in","‘As I said, PM Modi is scared…,’ says Rahul after Lok Sabha adjourned ahead of PM speech theprint.in",,theprint.in,2026-02-04 08:00:00,,https://news.google.com/rss/articles/CBMiugFBVV95cUxQMnlwTDAwekg5cUQtV21CdnRYVVhRYW8taHJFRlk0VE4xbE1EUW1pdll2VlgwSEs4STVFOWJjNEJnekRmdVJ0eTBSckFQT2RuQ09UNmdHMHZLOEQzTTZ0ZmYxeUxNTzdhWFpRT3lNR2xHdVJMM1Q1QkpTN21nSzBubFBqYUtEcXQ1aGtfTG5SYTI1cXNuUmVsb2FNbW5YRDJWTjhLM2x4Y3lJNUdONkd4a3V6bWhoNHlhNGc?oc=5,2026-02,February,6,"‘As I said, PM Modi is scared…,’ says Rahul after Lok Sabha adjourned ahead of PM speech - theprint.in ‘As I said, PM Modi is scared…,’ says Rahul after Lok Sabha adjourned ahead of PM speech theprint.in",scared lok sabha adjourned ahead speech theprint scared lok sabha adjourned ahead speech theprint,14,1,Topic 2: sabha / rajya / rajya sabha,0.19091233892307904,0.0,0.19091233892307904,0.0,0.0,0.02210439603152606,0.011816930944309401,0.0
Modi,"Budget Session: PM Modi to address Lok Sabha, today – a day after uproar over Rahul Gandhi's speech - Mint","Budget Session: PM Modi to address Lok Sabha, today – a day after uproar over Rahul Gandhi's speech Mint",,Mint,2026-02-04 08:00:00,,https://news.google.com/rss/articles/CBMigAJBVV95cUxPWVVXcWEtQjljNW11UnEySzZOZDVweTFLeUtIN0xKUWFyRlN2X2pGWXp4WXVlYzRQc1dhYWQwXzBzcTZUSzN2czVYeGVoUmF0WTVpMTJ1eWRGS21GTkZMU1hhdHRKb2tSV2JSMVBoUGJpT2xBV2JyOER4TmRKSDBaWFB0OVFFQkxuNzlBRlUxYmRYbFhiNmZWQXpGVTBrQVFvOW5nMWxUWV9oVUtlV0w4VHpmbFJ0Y1JrcmduczlESDl1UXc3NEFreEZ1ak1ZellNaHBtUGl3VnRxeTdmWmFYVGhFd0Q3YjJLV0R6d2k2Q2xIWGE0MzhjU05jWFRMTnpQ0gGGAkFVX3lxTE5mcHo3U2VFcUs1MkJFRWRaTWxiRzR1bGQtU2ZpeUhfenFjNXlzQmtjSmI0ekRQM0RXLXh2eTNCbWpoUEVHclJKdldRTFZXd0FadzNjRDQ1MmVVMGxaZEd3UF9pYWRPNkdzODkwbXpLR1BIX0ViMWhpN1lTTmxzYlhEYTBrQ3hfcnBmSFRZTjVmUW50Y085RDdEdExyOWdPODlONzRQVG83THBSNF9YLU9tQjBodUxoeTZuRmdJM1ZzalNITFNNeUpjSUdnbnNKTVVzWnljVmRjZFlzeER6TW5RWDY3TjgwUWNJZUxtdTRRb09CRGE3a2J3QjkxNEhvVzc3eGhJX0E?oc=5,2026-02,February,6,"Budget Session: PM Modi to address Lok Sabha, today – a day after uproar over Rahul Gandhi's speech - Mint Budget Session: PM Modi to address Lok Sabha, today – a day after uproar over Rahul Gandhi's speech Mint",budget session address lok sabha day uproar speech mint budget session address lok sabha day uproar speech mint,18,1,Topic 2: sabha / rajya / rajya sabha,0.19908476087638638,0.0,0.19908476087638638,0.008241213025665165,0.0,0.08451112621620561,0.006515648225015014,0.0
Modi,Video | PM Modi's Speech Deferred as House Adjourned Amid Ruckus - NDTV,Video | PM Modi's Speech Deferred as House Adjourned Amid Ruckus NDTV,,NDTV,2026-02-04 08:00:00,,https://news.google.com/rss/articles/CBMilgFBVV95cUxNN2EtSUxZTHU0c1lHTGpuRy1WR3BNUjBndHFzQXpDQXp6SzZ1X3JzUXZUcXFOYk11WTlhLTdWS1ctS2ExcFc4YzNNN005bnZoaXBUbWRBNl9WLVNKbXZCVGdoZkoyZUIycEhqalZfeTZzRG0tbThwMHJIZmtCeHo1S0dxUEtPX3N1RVhkbGhyUDZrcks3d3c?oc=5,2026-02,February,6,Video | PM Modi's Speech Deferred as House Adjourned Amid Ruckus - NDTV Video | PM Modi's Speech Deferred as House Adjourned Amid Ruckus NDTV,speech deferred house adjourned amid ruckus speech deferred house adjourned amid ruckus,12,1,Topic 2: sabha / rajya / rajya sabha,0.06895818592736827,0.0,0.06895818592736827,0.033501009044599635,0.0,0.003505155986015728,0.03947865210887321,0.0
Modi,Video | PM Modi's Lok Sabha Speech Stalled: Unprecedented Parliament Breakdown - NDTV,Video | PM Modi's Lok Sabha Speech Stalled: Unprecedented Parliament Breakdown NDTV,,NDTV,2026-02-04 08:00:00,,https://news.google.com/rss/articles/CBMipwFBVV95cUxPRVZBSFFER3FoMUVSTGF3dTZzcVhZNDlGMjFxNGxNcXR5ak1USnE1UDN3S2hvX3JSVEdsNmw1YkowSEJsNHFzREkzYmh1YmdvbjBzdXRPWVZUNTJqRmNoRmtPMktEdGszbDlQNk1rT0VncmlJRW9lLV84R3h6Y1pvYzc1cFZEdk55RnJ1bXNlN0stall0V3o2ZDkwWUtsSTRfYjh3SGd0QQ?oc=5,2026-02,February,6,Video | PM Modi's Lok Sabha Speech Stalled: Unprecedented Parliament Breakdown - NDTV Video | PM Modi's Lok Sabha Speech Stalled: Unprecedented Parliament Breakdown NDTV,lok sabha speech stalled unprecedented parliament breakdown lok sabha speech stalled unprecedented parliament breakdown,14,1,Topic 2: sabha / rajya / rajya sabha,0.27980058971302274,0.0,0.27980058971302274,0.018448015349705152,0.003822050388718642,0.0,0.018572382741104412,0.039687857159668674
Modi,Parliament Disruption: PM Modi's Lok Sabha Speech Halted - Deccan Herald,Parliament Disruption: PM Modi's Lok Sabha Speech Halted Deccan Herald,,Deccan Herald,2026-02-04 08:00:00,,https://news.google.com/rss/articles/CBMiugFBVV95cUxPZDdzYVlaTU1LemJ3SXpJV1lrTE5RWmhqV3poUThTU2xuV21fM2x6a2psSHR5eF82YlhmcV9IYklZX2ZkQXVpNFVYbXJJRHlhekQtdTdWS1NaTEIxQkdkdWVrWmRVLWJ2YS1wd2FNakRRRkNXMkNsM1VnN2NEVDYyeUNQbWVjSU9SSVZ0cEItRUVDSElfUWZwVEU0ajRGX19JSXd3Ymp2SThYdEtEd25JOEhZYk84YmdoVEE?oc=5,2026-02,February,6,Parliament Disruption: PM Modi's Lok Sabha Speech Halted - Deccan Herald Parliament Disruption: PM Modi's Lok Sabha Speech Halted Deccan Herald,parliament disruption lok sabha speech halted deccan herald parliament disruption lok sabha speech halted deccan herald,16,6,Topic 7: deccan / herald / deccan herald,0.3818811848367821,0.0,0.21269603586319305,0.00819377240960979,0.0,0.0,0.0,0.3818811848367821
Modi,"Lok Sabha adjourned amid opposition protests, no PM Modi speech today - India Today - India Today","Lok Sabha adjourned amid opposition protests, no PM Modi speech today - India Today India Today",,India Today,2026-02-04 08:00:00,,https://news.google.com/rss/articles/CBMiwwFBVV95cUxOOVcyaGRpZ0diR1hYQlREeGdrR0hyU0FLZERWMW92LTBPcWZ5S1FReXJoM0tZUkI3RzBnX1pGQndtbG1qaGtuOC14ZndfVEhaZHJoZUZRaVRlY1czWXpraGFGNXJKcFdxZzE1NXZXNjZ0bEpOUUIyTk15emtlb3ZpMDZzNDNlRzBNN0kyeDBBQzFfdUsyRVNwdGgyTm1BOXhwVHBwNmI4dG9TN2UwdmpTWFVlZXZPVHVQT2dkcGlEMmJnNFXSAcgBQVVfeXFMUGRldWQ4bWI2MnhlQUw2ZENXYktkZGphMkVKWE5SVWctNC1HZEhRYm9QWHVUQ1gxV0xJeVBkSWVKVEsxZWpzYWxYb2VTcWlKYTNjdDFBbUR2ZnM1VkpRaEx1dGh2Q1djQm9qeXU4ZE9Pd0lOUnBUbkJkSFdPamVPaG9WRlNaYTdpcDQ1cWpDS3JxUHl3aElka2xXMk1kOXlWb1FKY29MMWIzNno4Mk4wYmxQdkxKUDRLdFg2Q21TamZySWs5S0Nualk?oc=5,2026-02,February,6,"Lok Sabha adjourned amid opposition protests, no PM Modi speech today - India Today - India Today Lok Sabha adjourned amid opposition protests, no PM Modi speech today - India Today India Today",lok sabha adjourned amid opposition protest speech lok sabha adjourned amid opposition protest speech,14,1,Topic 2: sabha / rajya / rajya sabha,0.2035168086279581,0.0,0.2035168086279581,0.02165041866081299,0.001999931633169796,0.011038543395006735,0.0028349481408963813,0.0028064844364075665
Modi,No PM Modi Speech In Lok Sabha Today After Protests Lead To Adjournment - NDTV,No PM Modi Speech In Lok Sabha Today After Protests Lead To Adjournment NDTV,,NDTV,2026-02-04 08:00:00,,https://news.google.com/rss/articles/CBMisgFBVV95cUxQUW15dkF0TWhBOVJHWHV6QjJRMFhjMU9YOVJMajJ1dkMzTzMxSXpvbldRVXBfdkZEd0h0UzdZWnZ6dWwzbjJyNDJDb0kwUXpiWkF2dVVBN0dINUdMRjBFaFB4TU5YWkxVR2FpQmt1LWpDWldYMllsUUV5Wmw4MTZrWFljX2dEeTJOY0MyMUR6R3ZIUHpMYWJJSVRQX2tvd0w3NGY5MnY4VVRlS0Rtd1Q1cFNn0gG6AUFVX3lxTE4xTjJvdmFHeTkzNFpTUml0ckpFb09RTEF0VWtLUnp0T1hlUTZBRVprdDBiMTUyZHF3ZVVMZ1NUbzl6LXBiTHRqZmkxY0RjbGc4ZHQ5SkZ6UXZvdjE2anNhSkUxM3BNYUlfUmIyLVlIUXZrSEtCWldqR1FEaDRQckgzNjhDcmlSUzcwSFVtbmpkRkhtbE5KS1VrZHh3QUxOWnoyV2xKcjl3SXZDWTFEaW5EQnN0cG8yWUR2dw?oc=5,2026-02,February,6,No PM Modi Speech In Lok Sabha Today After Protests Lead To Adjournment - NDTV No PM Modi Speech In Lok Sabha Today After Protests Lead To Adjournment NDTV,speech lok sabha protest lead adjournment speech lok sabha protest lead adjournment,12,1,Topic 2: sabha / rajya / rajya sabha,0.2554119404359608,0.0,0.2554119404359608,0.0008406930563977892,0.004448283204035454,0.001592333387224455,0.012204497777513085,0.0
Modi,No PM Modi speech in Lok Sabha: What happened in a minute that led to adjournment - The Times of India,No PM Modi speech in Lok Sabha: What happened in a minute that led to adjournment The Times of India,,The Times of India,2026-02-04 08:00:00,,https://news.google.com/rss/articles/CBMi4gFBVV95cUxOelU5aGlvRXJ6UFBzOVVib3lXUFVHRzlfZnd5SkVjR1ltX2xVN1RjNFRyaWdTc3dFODh5b3dmUkJ2VTNEb2lPMGFYaU5BQ2V4QVE1a0JrenBWcDZ5MzVPRDk5dWdWN29PR2VJOTNDMUtLSmdCNXZPd1c4UmhlNmIwWmU1TEZzZXJFVHUwZWo0cEl4OXVSclUzcW9Ta2pXQ3hoc2NjdlBqMFFSUUgtcEhCVFNFamY5c3JrUXY2RHV4aEh4SmFFZ3NsX1FqZGdseUpseFN2ekpnbjUtVlJLMFBxaUN30gHnAUFVX3lxTE4tYS1kVXVoa1doOUQtWWhHZ1pDTS1jbWt5QUJWbkNUZHJiWk4wa1g1V1Q3ZHh1LWxEdjNyUnRmTFVGM2hNOWNQZFV6ZnE2S0txX245NHQzNGZ2OUNaR3g5SHlnaTlxS08ydWRyZ1BSTXlmZTlBdTY4ZHpiZFBrbUxUNVlrU0thVUpmcGlmT3FjWTNfanluNHdIbmNwWTg1RFZ6VUZFblBwRjFtWlpwN0lXN196THVOZGRuaEVuSVZEd2tmQ1dDQ0d0ajc0RUd6M1RJSFQ0NGdhT1dxc3pfSjlDNGlvcEFrWQ?oc=5,2026-02,February,6,No PM Modi speech in Lok Sabha: What happened in a minute that led to adjournment - The Times of India No PM Modi speech in Lok Sabha: What happened in a minute that led to adjournment The Times of India,speech lok sabha happened minute led adjournment speech lok sabha happened minute led adjournment,14,1,Topic 2: sabha / rajya / rajya sabha,0.2818833545959592,0.0,0.2818833545959592,0.0019227853176055412,0.0,0.0,0.01147778168969461,0.0
Kharge,Govt can’t hide behind the legacy jibes now: Mallikarjun Kharge - The New Indian Express,Govt can’t hide behind the legacy jibes now: Mallikarjun Kharge The New Indian Express,,The New Indian Express,2026-02-01 08:00:00,,https://news.google.com/rss/articles/CBMiwgFBVV95cUxPQWpRbXR4MlhOV1RaY0tPdXJLRTZDVzM5SkQybFdRSkRNT1JnRjRURzM2TEYxVW56OVZ2QmIzYmVWcllUSzFubHpTcWh1ZUtscnFjcHRyT1lvaDFNMk96SURfMzhkTW5wUTAzYTJvZzF5RVlxNDVhalFsRGtnX24zaFJsU0N5Yjh6RlRONnRGcVJBVTZvVWZ3emRyWkJjcGJnSk5sWUZNNlVPbGFYamdVYU1wTjJubkxYbVhhT29vbHlLUdIBzwFBVV95cUxNQ3NpcVU1Z2FLYzl5eG1heUcyR3U1a1NDOEtpVEFYaHllV0R6b1d5by1qM3RUdnloc3FDVjlWN1RsR0ZENVBnOGxOT0luQTkyZldpNXJSNmMyc2ZzV1JxZW52cWNSQjFTcUhWdmh5Tm1qb1VDanZmNTBfMWlaT01vZEV1OFlqZHJVeVh1X0JzNU5mUHJQb0wxWDNndjNKamYzRlg2UVJ4a2p0Z0pIOGo4Sk1xNUZ3LXNpQWgxVi04VDI3TnhHeXkwaENOUzNYSGs?oc=5,2026-02,February,5,Govt can’t hide behind the legacy jibes now: Mallikarjun Kharge - The New Indian Express Govt can’t hide behind the legacy jibes now: Mallikarjun Kharge The New Indian Express,govt hide behind legacy jibe indian express govt hide behind legacy jibe indian express,14,3,Topic 4: indian / express / indian express,0.34143500369107116,0.0,0.005097632226002522,0.0,0.34143500369107116,0.0,0.0,0.0
Kharge,Budget 2026: Kharge Slams Lack of Vision - Rediff MoneyWiz,Budget 2026: Kharge Slams Lack of Vision Rediff MoneyWiz,,Rediff MoneyWiz,2026-02-01 08:00:00,,https://news.google.com/rss/articles/CBMilgFBVV95cUxQYUVLZUtqZHoySjBjNkVzeEx4MzZBb000MXoybDFNNGgxcE5kS1VjeXJ6TW9fNklUZlZRSUdEdEdpMWZMcnZielpmcVFhQXVkU1JkMThHUHVLaW93UnNOdnVVS2xpN2NvZFpGVUp0X2FpUlFxTFJGbEFzWW9YX29HdWd0TzVGQ0owUGd4VEVKeUlyYTZxcnfSAZsBQVVfeXFMTnYxYzJXM1ZYei1QelhueXduYTFnM0x2LWdvZGtXbFJEY3dlTGxnN1VtTWFqTnh5aHp4TlY1Vk9HUWdkQ0tyQlZkNTZqZ0h4cm5VY2JKR0JJUjJ0LXZFcnB1WFlnOVMyVEw5a3NXdlNlQUQwNXYyMXpzZkFEa1lXRjhVRUlnNmJSUG53cmt6ODlfT19oY2hRbmlHUjA?oc=5,2026-02,February,5,Budget 2026: Kharge Slams Lack of Vision - Rediff MoneyWiz Budget 2026: Kharge Slams Lack of Vision Rediff MoneyWiz,budget slam lack vision rediff moneywiz budget slam lack vision rediff moneywiz,12,6,Topic 7: deccan / herald / deccan herald,0.05243408645622078,0.0,0.0,0.0,0.0,0.013763650985150607,0.02639447631941505,0.05243408645622078
Kharge,Delhi court issues notice to Mallikarjun Kharge in hate speech case - India Legal,Delhi court issues notice to Mallikarjun Kharge in hate speech case India Legal,,India Legal,2026-01-30 08:00:00,,https://news.google.com/rss/articles/CBMiywFBVV95cUxOQmJRRG5tODVuQmhoVVVPV3JlQlNlOEFCUklJOHF4WUx1ZVlXbWJHUTZaYjNpLUxuNV9LbGQwTVhuZWs3SG8xR0prbDgwV1pjWHpHQzBGVlpWaU56VHhhZk1Gck9TV1FrRmpuRGIwRklOUy1xNU90WE5PTXZPam5WbGdSRVJSQXQ3WXVRdFZjNmlZOHoxc1hlNWhHZ0NqdUZtXzNKVkNXMGV0LXZNR21OX0lUS05YUnBYZnY4MHprQWowZ3FuN0FqR3E1OA?oc=5,2026-01,January,5,Delhi court issues notice to Mallikarjun Kharge in hate speech case - India Legal Delhi court issues notice to Mallikarjun Kharge in hate speech case India Legal,delhi court issue notice hate speech case legal delhi court issue notice hate speech case legal,16,5,Topic 6: com / speech / call,0.1760476198376953,0.0,0.00446797137429889,0.0,0.0012181473492972536,0.0,0.1760476198376953,0.0048898936340517766
Kharge,Delhi: Court issues notice to Congress president Kharge in revision against rejection of complaint against him - ANI News,Delhi: Court issues notice to Congress president Kharge in revision against rejection of complaint against him ANI News,,ANI News,2026-01-29 08:00:00,,https://news.google.com/rss/articles/CBMigwJBVV95cUxOU0RWODdSZFprcW5KbnI1SG12M2h0ZzVjOHRua1RzUGd3ZEM3Y3F0dkltU3Joa1kxN3MyM0RBMm5pdURRZFRRMk84RldJdW9JWHFoQ0U2RkkteXgxSjZMNUpmLUhxem1WMlM2bXpYU1I4SHhObjhuLWNibDh6blJIOFUxaVgwbjFDOF9PbFFfWnZhY0hUdmtRWjM1eVdSM2IwODZ3eVBDdzY5ZWdlSlY5VWxKRmtLUjZBNFhWWWlrcDdjUC1SQ3NnTkJ2NmdvX2t6WFZUWDRHWDRtY0ItM1pPcWRMNjlia0RRNGhKWWhHRmFmLW1hRnpDaThRTXRQTzFMQUNV0gGLAkFVX3lxTE5ZVmdPcXZEOEJJNmZDb1hTM193VFlROVNUanlrYUlPQlZoaEVsN2pZcG9xeFhEbmRMcG9rTm92UkpGaktBdlJtemp5S214ZlpWUGtIeTY1VWFNdU40dnlXUEU3SGJZNERDYnZ5U3p4WUxsa0gxRWRPc291U0pvVnZOcXlVeDc5UHprcmpheTV5SFlYTW9odkEwMms5SWJhYWtIRVNBRlRNOVpJYzVQdDRsNFVoWjRBc3FDcU5kd2RJTV9qRnRUNUc5TmswckIyRWw2bFhBTFVwaFJYSVpxNElseHdZZXRMWktHb3FQdkRtV3BXWFN2ZDVsaEFWY1JJaWJyWHhRZHJBeWd4bw?oc=5,2026-01,January,5,Delhi: Court issues notice to Congress president Kharge in revision against rejection of complaint against him - ANI News Delhi: Court issues notice to Congress president Kharge in revision against rejection of complaint against him ANI News,delhi court issue notice revision rejection complaint delhi court issue notice revision rejection complaint,14,5,Topic 6: com / speech / call,0.12804517450941286,0.0,0.0,0.0,0.002041121951358943,0.0,0.12804517450941286,0.0
Modi,Hate Speech Against PM Modi: Delhi Court Issues Notice to Mallikarjun Kharge - LawBeat,Hate Speech Against PM Modi: Delhi Court Issues Notice to Mallikarjun Kharge LawBeat,,LawBeat,2026-01-29 08:00:00,,https://news.google.com/rss/articles/CBMi0wFBVV95cUxOSEpRc0tJUVBTN1ZQT3ZWcHVUV1kxYUREa0p0VTl6MTlaYm0xYVZKZHdBUlpydzhYNkNCY21tRTd0SEh1Wk9iTmNsc3Ria0lpdURkWEthcGxiRmFjOHZJQXRERDNPQ0xKd3ktajc1QmlYVkNiOHVLUmplZmc1LXhQd1BSMmp2WUl2TGk4WGdjUXlDOFRUdi01YXF6cnV0TFRGRzl1U0ltTWt1UVBFYjlYenVOU0VZTWI3YmwxUTEtWTZNcUJ2Z3NYVkFvN1BwZENRTzV30gHYAUFVX3lxTFByNXNsSmZ2eVRIbmNzSWFQRHNiekQxZVlKQ2JLNlVnR2VsQUtUZ09mZHZOa1dJbl92c29henc2Q25IdDJDcW1XMkM5eG1hUHhTR2NWeHlyN3Z1WnNfX0QwR1JYV3BsdWpKX0RkeHFDREFrR1pIRkxVcUF6cVhldkN0RTVfd1k3QW1XWUsyZFJlVHc2alp1MnBJX1J6QURRdUNQNWJsOUpMU2dPSmM2aFlQRF9oOG5PYjZteEdQWFBYOTlXOTEwdG1EaUF5UFUxV0FkVmwyN2pMQw?oc=5,2026-01,January,5,Hate Speech Against PM Modi: Delhi Court Issues Notice to Mallikarjun Kharge - LawBeat Hate Speech Against PM Modi: Delhi Court Issues Notice to Mallikarjun Kharge LawBeat,hate speech delhi court issue notice lawbeat hate speech delhi court issue notice lawbeat,14,5,Topic 6: com / speech / call,0.18444475534254728,0.0,0.0069926221597476175,0.0,0.0,0.0,0.18444475534254728,0.0
Modi,"Budget session: India is emerging as a ray of hope for the world, says PM Modi - The Hindu","Budget session: India is emerging as a ray of hope for the world, says PM Modi The Hindu",,The Hindu,2026-01-29 08:00:00,,https://news.google.com/rss/articles/CBMi0gFBVV95cUxOSzFzX0UySFUxaDg0N20wTG5lWHhacUcxOFRDNkhteUYtN2RBb2swdFJ4ZVJWQkFpdlN3RTlrMzVFYXBXSEplY1lpTktmT3BWWEl6WVVLb2NjcEhYazVzczZwc2xXZWZmVURianJ6WHFWSDh4X1lBN2k2T3RnYjlWSlVTcGxJRU4wa2Q2Y2pOaG4zZUtvMmhLOEpxT09xNFpZd2E5M1g2VV9zbUVfX0QzZlRXeTNNTWE5ZE9GWHUzN3RVcHRmWlBwSU1iREZoZC12aUHSAdgBQVVfeXFMUDZmcTg0WnJnM21MdERZdWtmWGNVZm5fNTgzS3Aza3RrNDhTUjNkcGlTZ3VXQno3RTI4NDJyS1hMdlVZZkhNUVpQLWRqOG4wdTR1SjQzbzZnYjBVS3BmLVNteXJCNDlvcWZhZ3RvcWFfYkFvU2ZnNjZac2pLcVN5VzFfQ24wVnhrMllmeTAyRS1vYmkzZ2hGZ0dtRVZfanhjUHozLWVSNzZDZDc2SDE1c01BSl9HOWVsSUZWYm5WR1Q0TFo1UmJ3QXREcUdPLV9oME16QVRjXzd5?oc=5,2026-01,January,5,"Budget session: India is emerging as a ray of hope for the world, says PM Modi - The Hindu Budget session: India is emerging as a ray of hope for the world, says PM Modi The Hindu",budget session emerging ray hope world budget session emerging ray hope world,12,4,Topic 5: address / march / assam,0.021623501769001314,0.0043350539611387,0.011443705884267408,0.005822828258580593,0.008982030584685103,0.021623501769001314,0.000759697820879132,0.0013436190384636523
Kharge,"Kharge Slams Centre Over President’s Address, Calls It ‘Recycled Ritual’ Lacking Accountability - pragativadi.com","Kharge Slams Centre Over President’s Address, Calls It ‘Recycled Ritual’ Lacking Accountability pragativadi.com",,pragativadi.com,2026-01-28 11:42:00,,https://news.google.com/rss/articles/CBMitwFBVV95cUxPLXBlalRpaWI0YUxPS3VoNjlYcUcyMl9HRnlQSXhkdG1KV1J4S2F1QWZObDJlSThILWZSY3JPT1A2bWpENkhsYS1kNW9nM1B0bDVaUUpwNkhwdHdpaUM1SW51V3BoenFORlpSSUtfcUQtYXRzbUZDYjJ3Ym10SV9QLVVvXzl1WDZUNHd5Q0labUh0OWg4QVdSSWhEMGFuWDBQc19OdDR3THBxOUJ1NlkxclN3MHBOX0E?oc=5,2026-01,January,5,"Kharge Slams Centre Over President’s Address, Calls It ‘Recycled Ritual’ Lacking Accountability - pragativadi.com Kharge Slams Centre Over President’s Address, Calls It ‘Recycled Ritual’ Lacking Accountability pragativadi.com",slam centre address call recycled ritual lacking accountability pragativadi com slam centre address call recycled ritual lacking accountability pragativadi com,20,5,Topic 6: com / speech / call,0.19840716396535826,0.00297554816120953,0.0,0.0,0.0,0.07747005605962436,0.19840716396535826,0.04843513099856018
Kharge,Kharge's ‘recycled ritual’ jibe at Modi govt after President's address in budget session | India News - Hindustan Times,Kharge's ‘recycled ritual’ jibe at Modi govt after President's address in budget session | India News Hindustan Times,,Hindustan Times,2026-01-28 08:00:00,,https://news.google.com/rss/articles/CBMi4AFBVV95cUxPVDRjVjVRc0M3bVB5WjBxQzBRcnJ3WUdvaXZId3FJMURkZ25jQzIteVhwTjRLVFRTeGtuS2h0a2lSTkFFbnB4ODhpZzlmU3dRMnpkTWU2X2JiRUJaNlZVdGE2bHRoR3J1cGx0THNJZkZINHVRb0pRbW1od3BKR1ZVeDVIOVBXb0w2TTgtWE9Fbm1aeUN3UGZVSGVZMy1zclFqTkpkaTFOWnVaUUFORnBOemQ5Y3hfQ2FuajFYblAzcm9TRmpuNF9GTTl5NmpnN0VrU0M5bkttSXAyeXdQdFBTONIB5gFBVV95cUxOTFc4YzZSOUI5dENyMXhEZ3Y3ZlZFd3ZKczE5bTBwaGc5cFE0LUJ1UVlGQUJvd2c1MWdwUzVNMFdIZ1VrMzE2a3UtdUpJcnk4eFZzTjFOOEo5OVZXM0UwRWllSjBub0lDd051ZENzQkROUk1hdzdWdzdMeGI5cGpsVDNhWW5TMUp5Ml91RW8zSm1CN1pJOFVuN0dWczVXX1l5YjlSTnBvUTk3WlRQd0tsVTBTQTdqLWNKUG95dVFDRWlfVnoxdVhkWnlIdDVqY2JNRXgtaFF6dk82bG11V2dKd1hMblFuQQ?oc=5,2026-01,January,5,Kharge's ‘recycled ritual’ jibe at Modi govt after President's address in budget session | India News - Hindustan Times Kharge's ‘recycled ritual’ jibe at Modi govt after President's address in budget session | India News Hindustan Times,recycled ritual jibe govt address budget session hindustan recycled ritual jibe govt address budget session hindustan,16,4,Topic 5: address / march / assam,0.09569531818203345,0.0,0.034421518120397454,0.0,0.015780007599996565,0.09569531818203345,0.0,0.0
Modi,"PM Modi announces signing of India-EU trade deal, hails landmark agreement - Business Standard","PM Modi announces signing of India-EU trade deal, hails landmark agreement Business Standard",,Business Standard,2026-01-27 08:00:00,,https://news.google.com/rss/articles/CBMiqgFBVV95cUxOV2lTWWNxMWx1aVVIb1pHeUJJSGQ5TG9pSy1iMS1jeEZ1cmRwcWRlUVpxZXdtZTBIcmNVV2VvRnlBVmlQRTh0VUt4Q2M1SlNlRHRQNktVWTF5V0ZlVDB2NGtVaUVJdlhMdU10OVhRZ3BIcFN0RGtNUTdpYmVlRThxMGRia1JFMlNyQ19HQm05Z1VTYnQwN3RiU20yb2QzZmNkdl9oeEIyR2VDUdIBrwFBVV95cUxQa2kyQnZwM0p4VXpkNVgwXzJ4TDh6UkxRenZDWENyNGMyMl9SbkZ1Q0x2Tlp4aW5ycExQdnd4aVZBcl9wR2hRMWpVS1Y2em5vaXpFZDNCbjdnZG9XVDFkR0gtc1hpY0xtcEZKZG00N25FNG16T1FHZ25mQ3dEeVZCcy1hbUZ6cGh2bDFJUnd2aE9ubFVkZzNxVG5NbkZ1U2ZBOWJ5NWlEUEhURkpyZXlz?oc=5,2026-01,January,5,"PM Modi announces signing of India-EU trade deal, hails landmark agreement - Business Standard PM Modi announces signing of India-EU trade deal, hails landmark agreement Business Standard",announces signing trade deal hail landmark agreement business standard announces signing trade deal hail landmark agreement business standard,18,5,Topic 6: com / speech / call,0.03454469272187136,0.005526718733125976,0.009629421475836895,0.0075985620915555345,0.003998988547591665,0.0,0.03454469272187136,0.0
Kharge,"Republic Day: Rahul Gandhi, Kharge Stress Defence Of Constitution - Outlook India","Republic Day: Rahul Gandhi, Kharge Stress Defence Of Constitution Outlook India",,Outlook India,2026-01-26 08:00:00,,https://news.google.com/rss/articles/CBMiowFBVV95cUxPTGVVVzEySkNua1VSYVhXODJHZ2o4RWk0VTFYR3RGMnZuUnhtWmF2eFh6QVplLWt4VHV2ak4xS2lXa1N3UkxMNEZpbHRZVmVXekFYZklWSkxEbzk1eXBBX1V2ZHNlZEJuRW5jZ2pYdkotekNCR0JXUEJ0NmE2cmtFVjRuZXFuZHlld2RRNS1ZanlfdjJXUUkzX1R5a05TdHQ1YV840gGwAUFVX3lxTFA2Wi1EOFlWZGRqUWxqaUNJUXhhb2RnQUl1dDNoMlJqdlBIOWNiMXZHOUNvb3AtalpfMkhUQS1DRXRzbzZxeXFISDlHUmhDdEhmRWRES3N5NkJPbkxScldBSURfSUJHTmtzNGFoT0xuZ0lFQjJwdTJ5b2tNcDhZYjg2bWVlTnVtb3dkaXJiSWxaakRpYm44V3BCM1kxS2FjZ214UV90eURBbVFwN19NdG5V?oc=5,2026-01,January,5,"Republic Day: Rahul Gandhi, Kharge Stress Defence Of Constitution - Outlook India Republic Day: Rahul Gandhi, Kharge Stress Defence Of Constitution Outlook India",republic day stress defence constitution outlook republic day stress defence constitution outlook,12,1,Topic 2: sabha / rajya / rajya sabha,0.036050675326301046,0.0012081421991460477,0.036050675326301046,0.0,0.000966943866237366,0.0,0.014156075615122525,0.0
Modi,PM Modi to share his thoughts in Mann Ki Baat programme of Akashvani at 11 today - newsonair.gov.in,PM Modi to share his thoughts in Mann Ki Baat programme of Akashvani at 11 today newsonair.gov.in,,newsonair.gov.in,2026-01-25 08:00:00,,https://news.google.com/rss/articles/CBMirwFBVV95cUxQT19sVlZENWRoUUxxQlZuc241V3hKYXVrazRzeHN3X2E0MGtkbXdYUnhYWTRNdndNbE5NbE52XzBid25ob3NFRXJ1Sld0UVY3Z2ZBRW1RMG1IY0poWExUc1JaYXlJZUFHSHNVQXJpVDFmdVZhMFRoM3ZSYWlfbFNrSkgxeDRMbFVzRThWbm9FWVNzUTBUSVJDd2xNN2NOaDZGZjBpaVpzZWVJYi1GQnJr?oc=5,2026-01,January,4,PM Modi to share his thoughts in Mann Ki Baat programme of Akashvani at 11 today - newsonair.gov.in PM Modi to share his thoughts in Mann Ki Baat programme of Akashvani at 11 today newsonair.gov.in,thought mann baat programme akashvani newsonair gov thought mann baat programme akashvani newsonair gov,14,0,Topic 1: baat / mann baat / mann,0.1677355529380189,0.1677355529380189,0.0,0.0,0.0,0.0631925156070597,0.0,0.0
Modi,"Video | PM Modi News | India Doubled GDP In A Decade, Emerged As Global Manufacturing Hub: PM Modi - NDTV","Video | PM Modi News | India Doubled GDP In A Decade, Emerged As Global Manufacturing Hub: PM Modi NDTV",,NDTV,2026-01-24 08:00:00,,https://news.google.com/rss/articles/CBMivgFBVV95cUxObi1hQUNmUnRvOEt5VXZHOTVnb0dwM1JwN2xWOG40RzdjaDZMT0dHdW0wYVNjNldkQ3ZaR28wa2I5dGc5R2k1ODN0Q015N0FNR1N4SGh1aUxzdzhleWdmcVdMdjdfbXhSQlZVNTVXVXJHY1hjZUg1SEZ1Q1p5TGpDeUNxOG8ycmNpQ0kwVkhQczJ4clZrR1lkSFZvTkR1cXNmbHZrYzFSRF9CQzZ3R2pzbWNYS0dqVTNYLXY4S0FB?oc=5,2026-01,January,4,"Video | PM Modi News | India Doubled GDP In A Decade, Emerged As Global Manufacturing Hub: PM Modi - NDTV Video | PM Modi News | India Doubled GDP In A Decade, Emerged As Global Manufacturing Hub: PM Modi NDTV",doubled gdp decade emerged global manufacturing hub doubled gdp decade emerged global manufacturing hub,14,0,Topic 1: baat / mann baat / mann,0.023219753771776444,0.023219753771776444,0.0,0.018658327593606343,0.0,0.0,0.010928526590577197,0.0
