Speaker,Headline,Summary,Author,News Source,Published,Tags,URL,YearMonth,Month,Week,Full_Text,Clean_Text,Text_Length,Dominant_Topic,Dominant_Topic_Label,Topic_Confidence,Topic_0_Weight,Topic_1_Weight,Topic_2_Weight,Topic_3_Weight,Topic_4_Weight,Topic_5_Weight,Topic_6_Weight
Modi,Video | A Landmark Moment: PM Modi's Powerful Address at Israel Parliament Amid West Asia Tensions - NDTV,Video | A Landmark Moment: PM Modi's Powerful Address at Israel Parliament Amid West Asia Tensions NDTV,,NDTV,2026-02-25 08:00:00,,https://news.google.com/rss/articles/CBMiwgFBVV95cUxNcUhmbXR5a0ZfWGhqLW9fbWV0d25tZ203aldTc1ozRElNS28tSmlmV1FpVjVsOWlpZUQ2MWdfcjV0ei1GZjV6bnNOV09NYnJVRllrOGdKUkExWnhTOWRGT0xOQXhsTEFoWVE5UzVJWFFkbHRVX3RWTDVEcGc3ajlJajZIMjhSTHFFNEtuVFg3QkUyS1NEaWtRNXRfanc4SHV2TjVjYjJUN1FUV3dFS0k0ZWpOSTBKT1ZSaDFUZHUwMzI5QQ?oc=5,2026-02,February,9,Video | A Landmark Moment: PM Modi's Powerful Address at Israel Parliament Amid West Asia Tensions - NDTV Video | A Landmark Moment: PM Modi's Powerful Address at Israel Parliament Amid West Asia Tensions NDTV,landmark moment powerful address israel parliament amid west asia tension landmark moment powerful address israel parliament amid west asia tension,20,2,Topic 3: west / west asia / asia,0.3098835480934794,0.0,0.0,0.3098835480934794,0.00030132503303199225,0.07163477028944355,0.0,0.01699926121638942
Modi,Full Text: PM Modi's Historic Speech At Israeli Parliament - Swarajyamag,Full Text: PM Modi's Historic Speech At Israeli Parliament Swarajyamag,,Swarajyamag,2026-02-25 08:00:00,,https://news.google.com/rss/articles/CBMijwFBVV95cUxPVkZ1c2ljdnNBZ3hNUjFLaUszTGxTZE85UjBsOEtTWUNwRExra3lwVjh6eTR2ZXJsQmFSLU5tWHVMdjJiUnExSnlUaF9VMll0RE5qVWVnTFNNMWtHTndmYm91XzVlNkpwVnN3VGhVZEZQUFBPMUR2TGN0eG80RUZGZS1pTkhHYjJnNl9LSlJjSdIBnwFBVV95cUxQWERDMW9VdHhhNVlKYkQ5dm45ckNIaERob2NsbGN1Z0d0R3UwWGpNMDhLOWRTZmcyeDNRVURQQ3hQQmtZTUY1X2VFdXFLYUg5R2t4QVBaX1ZtR2h2cDlqTHJNMWZ6SjJ5NDJienZwZ1ZHQktHTHRDUGJHWmpFUWVJWnB0WEtlV1d0Q1JVV0E1bks1OGZfZExLYk1tTW9iMmc?oc=5,2026-02,February,9,Full Text: PM Modi's Historic Speech At Israeli Parliament - Swarajyamag Full Text: PM Modi's Historic Speech At Israeli Parliament Swarajyamag,full text historic speech israeli parliament swarajyamag full text historic speech israeli parliament swarajyamag,14,5,Topic 6: com / speech / call,0.06799577527424897,0.0,0.03207605651634427,0.03346401591359086,0.013357106748165926,0.012911787840694234,0.06799577527424897,0.04801222880419856
Modi,Prime Minister Narendra Modis Knesset Address: India-Israel Ties Reaffirmed With Full Conviction Amid Gaza War - TheWire.in,Prime Minister Narendra Modis Knesset Address: India-Israel Ties Reaffirmed With Full Conviction Amid Gaza War TheWire.in,,TheWire.in,2026-02-25 08:00:00,,https://news.google.com/rss/articles/CBMi4gFBVV95cUxOTHc5SUhqb21pWDNtNjRpc1JuYTdVSkdUOUJVVkpCR1ItT2VjMEdXaWlRU3BqSEZ3SUxoVWVBR1V6UHNNNy01N3lYZzhvQk9QX2J6VGtpNWVsYUtlUG1lSGV4b2VNZnktY29nWHY0amdxbk01UXRVMW9sZmgxbmJxNXZmMGFMUlVIWUs2Z1pRVlZhTkEyZ2NZeV9XR0FkQVBXNWFiVGcyNGRrYy1mUTljc0JzNGFDWGZnZTdKYWx4eEJrVG1MUlpMTUhoYm96UW5VZ3RmY3dOR0YxQ2NLWDBCMENn0gHnAUFVX3lxTE5KdG11X1pWUXVuZ0JJenVhbjBQX3NZYWdZQjZ6dUdPTnBTb2Q3YU9ZX1BteGpGTlRtaFFIcUZfY1VIaEpPdkRWRjVmLVB0SUZmcVJtTmxOZGZoNmNITUpzZjRkYkRpek9PcjJFMUQwcTBBRE5uQ2hqLVNKa3lUdWtMN280a0dLYmdpbzhsa2p3VF80MkhBTHVzNG1oUmlyekxYb253ZTRuVE9Pa193SVNmNnZtQU1qemd5NFRZS3Y3SzhITDZlaFA5UDQtajBRQTM5TXJIZF91bEt2M3JlaWktWFc3a2gxaw?oc=5,2026-02,February,9,Prime Minister Narendra Modis Knesset Address: India-Israel Ties Reaffirmed With Full Conviction Amid Gaza War - TheWire.in Prime Minister Narendra Modis Knesset Address: India-Israel Ties Reaffirmed With Full Conviction Amid Gaza War TheWire.in,modis knesset address israel tie reaffirmed full conviction amid gaza war thewire modis knesset address israel tie reaffirmed full conviction amid gaza war thewire,24,4,Topic 5: address / march / assam,0.12360312391814178,0.0027047327333032402,0.01136546483928089,0.07392756803640407,0.0,0.12360312391814178,0.0019186039009999635,0.002226492157152053
Modi,"PM Modi in Israel: India ‘stands firmly’ with Israel, Modi tells Israeli Parliament Knesset - The Hindu","PM Modi in Israel: India ‘stands firmly’ with Israel, Modi tells Israeli Parliament Knesset The Hindu",,The Hindu,2026-02-25 08:00:00,,https://news.google.com/rss/articles/CBMirAFBVV95cUxOSXRYc0x0WWNDMWwtYnZxaS1ZQl9IMWswcnQwQm5fU19Ccm1rNWpJa2FfeVFub2ZLbHZTaE9WZEwyNHJWdHdicVphd1hnbXdTZzk2UHVJSWpXQkhiZW5nMWVNdk02QmliQWttVV9zcmNoa1JOeE03N3BnN1FyNlF6d2FVSUtPQjJqRE5VUTBmSmFfZ1ZWYnZrZ0FJNW5WY1M0eF85aElENFBzbHot0gGzAUFVX3lxTFBBY203WGd5c0xCRG9YSFltTlltYmRYdDdnazJNRmszY2JoRmFzQXktLVRZTmhxMElvRUF3S0IyMEYtX2k3OVdPZVpfS3YzaUQyLVRmVlZrMGpzUU8xdUFHaTU2RjlhZGhmN0Y2WjFPV2NEZ2xKQUROR0hKd2tBZ2tpTE1SUmNCUW5QN1duNVhfdFNBSGVXLVh0SDdrWG0ya0ZtbUFpa1NGZ1ZxSGs0b1F5eThF?oc=5,2026-02,February,9,"PM Modi in Israel: India ‘stands firmly’ with Israel, Modi tells Israeli Parliament Knesset - The Hindu PM Modi in Israel: India ‘stands firmly’ with Israel, Modi tells Israeli Parliament Knesset The Hindu",israel stand firmly israel tell israeli parliament knesset israel stand firmly israel tell israeli parliament knesset,16,6,Topic 7: deccan / herald / deccan herald,0.04523861411751576,0.0,0.0027835205050441023,0.033045605260235054,0.01275288191872157,0.03379865930295276,0.01296865304515025,0.04523861411751576
Modi,You Mortgaged India’s Dignity to Trump: Mallikarjun Kharge’s Jibe at PM Modi - thecsrjournal.in,You Mortgaged India’s Dignity to Trump: Mallikarjun Kharge’s Jibe at PM Modi thecsrjournal.in,,thecsrjournal.in,2026-02-24 08:00:00,,https://news.google.com/rss/articles/CBMiiwFBVV95cUxQY0x0ZnRUMzR2akhQbW1jWUxheFo1RU9TMmlzQU9Ya1NGMGZqb1VzVk4xTG5VbGdsRm5Yd3JYN3Ayc1owVVdqaGY2NFFvYmVCWlNBQ1lDZU45OUxhM2ozTmVuWnVlc1dUX0NfbDUzS0xKR1BCWk5mOHVwVGItZVZ4enpNbXhhb0hOY1RZ?oc=5,2026-02,February,9,You Mortgaged India’s Dignity to Trump: Mallikarjun Kharge’s Jibe at PM Modi - thecsrjournal.in You Mortgaged India’s Dignity to Trump: Mallikarjun Kharge’s Jibe at PM Modi thecsrjournal.in,mortgaged dignity trump jibe thecsrjournal mortgaged dignity trump jibe thecsrjournal,10,1,Topic 2: sabha / rajya / rajya sabha,0.03461433817125533,0.0,0.03461433817125533,0.0,0.014905708052405365,0.0,0.0,0.0
Modi,"Israel’s Opposition to boycott PM Modi’s address to Knesset as mark of protest, says there is no opposition t - india.com","Israel’s Opposition to boycott PM Modi’s address to Knesset as mark of protest, says there is no opposition t india.com",,india.com,2026-02-24 08:00:00,,https://news.google.com/rss/articles/CBMijAJBVV95cUxNSW5BYzhSQTFCZ2VKWjd1NmIwclV2b0N0RlBWeEpjUVNDUWhNaDNwQngwbHpBSWtOcF9nMWx1OC10YlBsS01INUNJa2RpbDlZaWlFTHJhbVE0UDA3Tk8zbGt0ckhodEdlaFBwRlUtWUZBRHhtakNBeHFUT3B6WmRrOXhabE00aVJhZjZSckVGQXdaS1k2TGIzYklmcGpJTWpLMzYxNUZBeWpMSGVVS2l6NFlTRlhvTWgwU1dBYXRpR2dxVU5HaFZGd0NDWjE3Tk1uZ2JhMG1Hcm0tSnZJTmxRSzQ5VUZFbDNtZExYeTJUVF9Bb2oxVzU2Si1hWGlGcEtpNW9CSzRzWm1vU3l00gGSAkFVX3lxTE1WOUVKNG5HN1psMXdiNnlhdDFaTnVuZS1LM1hJR0IwalprQm15djZYMGdjb2xSMlZsYXNpN2xHLUpYNHM3ZVNDOFV4STV6ZF9mRU9jcU54bkI3SzhJMVE2eW1LdkFpNU1LeDlZOWFXSS16dkdsc1V4cXpqclBWdm9iV0ZJdlUzNTVFNlhzQ3J1d2F4S2RLSGJUUHN4RjhpV1gxQTNwc2lqZnZJZnRlS09WRThsQzlCMjV3S1d4UnhHS0F6UldGTk84cDZKbzVhbV9ZWFVNYmNvM1l4OWRraU90V3hFQndLT3NFbkl0OHoxLTJuWFJLdzlyUzc1dDZDblFZakc3WEpxQ2RTUnFUaWVoUHc?oc=5,2026-02,February,9,"Israel’s Opposition to boycott PM Modi’s address to Knesset as mark of protest, says there is no opposition t - india.com Israel’s Opposition to boycott PM Modi’s address to Knesset as mark of protest, says there is no opposition t india.com",israel opposition boycott address knesset mark protest opposition com israel opposition boycott address knesset mark protest opposition com,18,4,Topic 5: address / march / assam,0.1127704750974392,0.0009199601829764744,0.019107391552992115,0.004949405032513267,0.009282327620613621,0.1127704750974392,0.08348940516743288,0.014312100106756988
Modi,PM Modi's visit to Israel getting entangled in Israeli domestic politics - The Hindu,PM Modi's visit to Israel getting entangled in Israeli domestic politics The Hindu,,The Hindu,2026-02-22 08:00:00,,https://news.google.com/rss/articles/CBMivwFBVV95cUxOMmY1enhpVW1kZENvQlFPRlNHVXVKQjRvMXpmWTFhWHhLT1ZfaXVZQVdadlFwVmlhZVRIWG1yYWs2Sm9GbzJIaFh1Yjd3S0I4ckhLRWpsQ2Izd1VPcDk2WnlGeUpyU2ZOUE8wV2NwNGtSTERIcnlqVkpMSFVlQlI0LTlPSEdNNXhZbDNRdUpCTEdBN2hjNF8xLThvU0tDU2pmMDJxNlJXaXN5M3hrTkM0TzFUel9IekM5U3cxYjgyc9IBxgFBVV95cUxNVGUzd1ZrNEZXdHk0OWJPOWlvUVh4UmliTEhBWXRlTWxxNl96Q3dIUmlhRUVCMDNtQzNfR28tNjQxNHcxdDVwZU5oZnBqZFFzUzZpRFpTT0tlYndvQUZWQklnMTVSUmFPRUNGcFYxRUxyUmNlaVRqWUZYNlVGU1NxNWtKVzhULWluWDFEYnc2Z3dzd3c3eFh0RlNLa1pScjRiWUNWa193V0RmTThlUUVfY2QtcVE2WHlKWHFGZ216ZTFQRU9YYXc?oc=5,2026-02,February,8,PM Modi's visit to Israel getting entangled in Israeli domestic politics - The Hindu PM Modi's visit to Israel getting entangled in Israeli domestic politics The Hindu,visit israel getting entangled israeli domestic visit israel getting entangled israeli domestic,12,4,Topic 5: address / march / assam,0.025905155871716788,0.0,0.0009845561457389293,0.006899942622117549,0.007079034399692079,0.025905155871716788,0.019654131141219413,0.007543295346418697
Modi,"PM Modi’s Meerut speech focused on opposition, nothing about public’s concerns: Congress - theprint.in","PM Modi’s Meerut speech focused on opposition, nothing about public’s concerns: Congress theprint.in",,theprint.in,2026-02-22 08:00:00,,https://news.google.com/rss/articles/CBMiuwFBVV95cUxPMEU1cVRvampObVZTRVEtY3pNUkliZ3Nfa1ZiV2NiY1NvTkJmN1RNQ1VmanVQZ1RiZkZ2cnZtdl9tVUlsVnNNbUlkaDdfcFkwMUgzdlRKNWpHaXhCcnJRTXB2eHMza3BhU2VSNy1VS1Ytdl9HcnVJdDFIM0VZTEhUR2FQcUNkc2M1UlQ0M2Z1a1NzeDhXSTFsTXhLbmk5SG5FQUptYXZIUDFLMzdhQzZqdDRoUjF6TFhNZHQ00gHAAUFVX3lxTE5PaEFOLURZRzFTTnJVQ1V2WkJSYWM0M2JGZkhhOG5Ibm9RZFhhMWdLZ2RVZzZWT1Q3X0RQckhwUHR4SzJPUXkyZ1JZS2lRNEdBTHFKcTg5eDFLQzdReGNlNUZJT2ozeHdSZlltVzNWNEZZbjdDTjIzNGMtQnJfa0E4MElDVEdRSU10N3pSMXpSVlNzLWVNZ1U3NklEQV95SHByV3F3bFBhdmhMS05mTGg2dzU0R3pRejc1dkRDMXNxbg?oc=5,2026-02,February,8,"PM Modi’s Meerut speech focused on opposition, nothing about public’s concerns: Congress - theprint.in PM Modi’s Meerut speech focused on opposition, nothing about public’s concerns: Congress theprint.in",meerut speech focused opposition nothing public concern theprint meerut speech focused opposition nothing public concern theprint,16,5,Topic 6: com / speech / call,0.06035140963214996,0.011162164933075158,0.04463997757282268,0.013009895193836588,0.0,0.00048614511108487107,0.06035140963214996,0.024655291762642695
Kharge,"Rahul Gandhi, Kharge likely to address farmers conference in Sri Ganganagar on March 9 - Tribune India","Rahul Gandhi, Kharge likely to address farmers conference in Sri Ganganagar on March 9 Tribune India",,Tribune India,2026-02-21 08:00:00,,https://news.google.com/rss/articles/CBMiygFBVV95cUxQRGtaeVl4cnlPUC1tT2RwR0tmNzFHQjQ1NTR5ZkxtcmVJZGQxUjBVZFZXQjM2Z2hhVFlqaUVMV1VneF9UVGNHUEdfWGtvRGRPVFQ3SlNvWXRkMzd4cE8xc1hJTkNGMW5hVWxSenJMZ0FuRmxWNVlLeG96WEVzc1pEaVp4QjhpR2xIQ1paOTA5MExoaW4tYmJWbDVfS0ZUWVNFcjhPZS1tcWF6dHNFdm5na3VadXhyYVd1TFM2eDFxNWlpN1Q3TWNOTmpR0gHOAUFVX3lxTE54MXNEMk94eXA0clhMNkhES3Y4SXJZU19XeDRGRzVQQXFtN2hnWUxreEN5akRlV1Z0VDJzQ1VFWEdVN3lyZGtHTFAzMjI3RVdXZ1VtZUhha3FmSDBjcUhQcUJsZG10N2w5emFSRmR1T3BQNDl3M0ZpNlRJOFI1bmdqVGJlcVNFdVBWdGNyWFIyQjZkaVdha2NFNk5FcFk4ODZtcWRtcjljd3N4RXNreVdBRkl4N29xbXpGd1ZpeEVVLV9sUGFVMXh5Um9JU0FB?oc=5,2026-02,February,8,"Rahul Gandhi, Kharge likely to address farmers conference in Sri Ganganagar on March 9 - Tribune India Rahul Gandhi, Kharge likely to address farmers conference in Sri Ganganagar on March 9 Tribune India",likely address farmer conference sri ganganagar march tribune likely address farmer conference sri ganganagar march tribune,16,4,Topic 5: address / march / assam,0.20244961165721287,0.006765885012277379,0.002424933723615928,0.0007287824522983526,0.0,0.20244961165721287,0.0,0.0
Modi,'PM Modi torn between grips of US & China': Rahul returns with jiu-jitsu analogy; explains why he used it - The Times of India,'PM Modi torn between grips of US & China': Rahul returns with jiu-jitsu analogy; explains why he used it The Times of India,,The Times of India,2026-02-20 08:00:00,,https://news.google.com/rss/articles/CBMijgJBVV95cUxOcnVLTVFya05kOGYxX0ZvbGVrUXJWQVdHZjNPODNXWU5qSWtXUnpvRGVBdVBGSERGazd3RVBEU1FQZVAzSDNCd2R3eFV0d2ZoZDhqRTdRTllwU1lnQ1ZjanU4Y094OXdqV0FsdDVWbVhjT3BxaVYybEMzVllNUjk2ZWp4S3JOaW5RUy04eFBaczRFN1VDMFZZZHVfLU9WcE5RUk1QSUN4dXJ5cnUweGRvMjY3Vm8tei1Rb0V4a2l4QXgxZDVweWR2Nk5VdmY2Sm1DcTdBMTdGOW5aZmQtQjRzMG01WlZYZUVlcUxGcUlCYUFkOUg3US0tcHJjUjNCUFRNNk1aTzFibzhIM0R0TXfSAZMCQVVfeXFMTkttUHRJdjkwdFlNcXRMWk5LNE9XZnpyMGxHOXVacFB3U2xxeVU5d0hIa2VEQXBGUHV3Q0VVZktRRmtCWm5jN2V3ektZYkxRZWRRRmd5OVIwLWI2bXU2NmlZNGFpYTRzVWhRQmNIdUx6ZlZWdXNLZHhNR1hib05TekNlUFhyMlRCaFRJcXVsZnh3dGl1ZjN4a1NibEs5al9HOVlGTmRUM1htUkQyem9XMXNCLVptV3dmUmlEc2RpSk56a1lKYmI0Zk5yMlAtNUJSTGgzQmc4eXlOcERIVERCak03aERmQmNGckJhdjRvN1Z2aENfSlRRbGJlVkNRVURNRmlKcXJtUU1rQzItR2QtUVVNQ1U?oc=5,2026-02,February,8,'PM Modi torn between grips of US & China': Rahul returns with jiu-jitsu analogy; explains why he used it - The Times of India 'PM Modi torn between grips of US & China': Rahul returns with jiu-jitsu analogy; explains why he used it The Times of India,torn grip china return jiu jitsu analogy explains used torn grip china return jiu jitsu analogy explains used,18,0,Topic 1: baat / mann baat / mann,0.0,0.0,0.0,0.0,0.0,0.0,0.0,0.0
Modi,AI Impact Summit 2026: Here are five key takeaways from PM Modi’s speech - Fortune India,AI Impact Summit 2026: Here are five key takeaways from PM Modi’s speech Fortune India,,Fortune India,2026-02-19 08:00:00,,https://news.google.com/rss/articles/CBMivAFBVV95cUxPeVE5cWpXNElCbzZMOXBKRThZMERGcnlIb2JCX0dSMjB5RlpqZU81RWtqV2RwNS1LX2FRTTF0eDlmaVl6T09YVG40c0VqeEtvNF9SRlZzQ3pPZTRMX0Q4T0EyMlhrUGpwNW5SRjVrX1p3U0t4QlU0d1RxMTlzY2p0MG9CU3JCdzhVbnV1RUhIUVF1R0RNUU5lVnhxS0xsVFNXbXRIN0VBemxUZDZ3TllSX2hTREtrUVRJZXluZNIBygFBVV95cUxQaUxrVWlKa1FsYWNOTnRnMW9OdHpIZE9idHR4dTdENGJRQzQ2a0MyVTFSUnpCVHBZOUZUOTFnOHNlWHdqLThDR2o3ZDhJTWRwOUhYM19QbEhvSGlTTFlvelpac25DcXEwcG9tLW1wNFg3MGpMYWdZVTVfd0h3OGRab2JTNmdYQWJVZl9BQ3BpVGw1NVh3a1VqajQ2ek5PVVVqamtXbDZCQ0JfWFdjc3BzWTRsRUhRcXZJYVN5LUJYMTJxbXUyYmlkU2VB?oc=5,2026-02,February,8,AI Impact Summit 2026: Here are five key takeaways from PM Modi’s speech - Fortune India AI Impact Summit 2026: Here are five key takeaways from PM Modi’s speech Fortune India,impact summit five key takeaway speech fortune impact summit five key takeaway speech fortune,14,5,Topic 6: com / speech / call,0.066406718413756,0.0015689151319950043,0.040689129152381424,0.0,0.0019573800234586633,0.024575922369521767,0.066406718413756,0.0
Modi,Meet MANAV vision: AI-powered sign language demo translates PM Modi’s speech - Mathrubhumi English,Meet MANAV vision: AI-powered sign language demo translates PM Modi’s speech Mathrubhumi English,,Mathrubhumi English,2026-02-19 08:00:00,,https://news.google.com/rss/articles/CBMiqwFBVV95cUxOZUNGZlFIT0xFOHNiVXhlYUtfRGxCX2pwUmtyUC1HY0dwTFNfay1HaG1JR3B6ZGNNVmJqdFRlVk9haDk0Um40dktsZXRzd1dQcWVBd3hNcmdzSktfN1lSbDMtSzV4RXpERDI5dlRJdGhWSjFOMGx0ek5yLXFjR0JiNXVoeWNFc1FYMDRweEtCN2ZOSzJkdVVVWmNaWlhJQ25kU1dvelp5S1duVEnSAbABQVVfeXFMTzNNcW1oRkhCa0lSX3gzODZZQ1gzZHRGTlVQcHJ3M1ZQTGdNLTZGcWtjbDRLelo1b0Zqa0t0Vm5jMEZkcmZ5eUFZUFdmMGg5bGpPekN2UVVIQ3dQdzRKTGdnOUhIcHFYbGZWRGFqZlR5ZFk4SnpXVjlZejBGb2dUNmk3cTZBdjUzbjFvRFI3S1AyUDFKcF9kLU1yQktuMEExa3RTTnA0NmtKYlZPOURsdzI?oc=5,2026-02,February,8,Meet MANAV vision: AI-powered sign language demo translates PM Modi’s speech - Mathrubhumi English Meet MANAV vision: AI-powered sign language demo translates PM Modi’s speech Mathrubhumi English,meet manav vision powered sign language demo translates speech mathrubhumi english meet manav vision powered sign language demo translates speech mathrubhumi english,22,5,Topic 6: com / speech / call,0.07277845372954228,0.0,0.03827169158711972,0.01635710131373389,0.0,0.0,0.07277845372954228,0.0
Modi,"India's AI leadership admirable, PM Modi's speech visionary: UNICRI's Founding Head of Centre for AI and Robotics - ANI News","India's AI leadership admirable, PM Modi's speech visionary: UNICRI's Founding Head of Centre for AI and Robotics ANI News",,ANI News,2026-02-19 08:00:00,,https://news.google.com/rss/articles/CBMiggJBVV95cUxOdmdVMTNQSkZidjZ2LXlmdFBVeklhb1k3R0NpQ2N3UnkwZllVTTZmTnJTcFNncFN1VTJWeHB1b2Z0WVRMNkJrMS1mZmJESnBoS0k2V3l2M1BSbkN4cEkzSjk2SUpuWEFxYTVKdjU0S0haNTlFZDFOX1dVRVZlOGFkYVFZTERzX2FfeTRhblcyYW10WEZLcHN0OFYzZ0p0QXB5dWljNXJkaFJIYmZuclJmakN6Vm0ydVRxOE9wMjBwN3NDU2hIV0Zkb0Q5QUhoeEZScFRQczJWQWoxVXMwZEU1YmRkYlBYbnc1MkdMTWZnUnk3Y1ZGYkNlcDdTbGdwOXpzUUHSAYoCQVVfeXFMUGpvZjBtSEEwSlQwS0pjdGhkWnhqMm9Ebmg3V2V1SktqMWlCLVhPcEh3cTZvMk92c1YwdVlzc1p2R3FlQ3BjaG00dUxrTTZ5R0VMWkZ5elh0R2dhZzVkQnY4SmtpTFB3dml0Ym9VNVBudkc0d2dKODlpVUlJcDhUTWJ2ZC12RmtBSTdWZkZmMS1rTEtQR0V5NXZBdUZ2M290YkJoSU45Ykd0c3RXbC0xcVpmVkhaNmVWWnhuTTIxTW44cFhQOHVkUTcxQUdpRjZGU2ZCQmJLTjFqN1VrQzJER1JmSUduclF4LXhMNHJUYVlFVEowOHBHbzdUTXM1XzRBOEtaYzJuMDJhVUE?oc=5,2026-02,February,8,"India's AI leadership admirable, PM Modi's speech visionary: UNICRI's Founding Head of Centre for AI and Robotics - ANI News India's AI leadership admirable, PM Modi's speech visionary: UNICRI's Founding Head of Centre for AI and Robotics ANI News",leadership admirable speech visionary unicri founding head centre robotics leadership admirable speech visionary unicri founding head centre robotics,18,5,Topic 6: com / speech / call,0.08165318024026051,0.0,0.04168461322187526,0.0,0.012915442775989699,0.0,0.08165318024026051,0.027448964766438586
Modi,"India sees future, not fear in AI: PM Modi - The Hindu","India sees future, not fear in AI: PM Modi The Hindu",,The Hindu,2026-02-19 08:00:00,,https://news.google.com/rss/articles/CBMisgFBVV95cUxPb3g2dDFUcWZwVWNDeUJNOVZldng3Ny1SVUdVVTVQQ3JwWGRRVk1FN0JGc3BpSm9FRWt6QTZHWnZSYmdWN1o3VE1CaWxCX3lNeUtncnVneEw5cjVsa1FfaFFTMzJMMl93eTBKNHR6WTFxUVVVUDhhaWdCY3JfSnE3eGtJVFJBcUtXYzFKZm1EaWN1dTFpeWp4OUZkeG02WThfdjFkaW9PTHZodGZpR1k5NFl30gG4AUFVX3lxTFAwdGg0ajdtTmVibHN1Z1ZKbW9jTlNmbHFSVy0tZTFqbm9UWjdaM2gzaHNMbnJYOTFmNUFtVEhtbXN0YlprVUpSRV8wVDl0UmdBeEtHT3NNRkYzOTUwWXJzMk5DQWtqbHplbDQtcmdHTy1VdkZqUEtCQS0ya2ZWNnU5LTcxdU9aWndYQ1B3NkkzLUJsakpwQ2hwWWk4bkpjRmM1QVQ4TjRwb2xrYWdpVFg0aDJId0ZCVWU?oc=5,2026-02,February,8,"India sees future, not fear in AI: PM Modi - The Hindu India sees future, not fear in AI: PM Modi The Hindu",see future fear see future fear,6,0,Topic 1: baat / mann baat / mann,0.0,0.0,0.0,0.0,0.0,0.0,0.0,0.0
Kharge,Delhi Court Issues Notice On Plea For Criminal Action Against Mallikarjun Kharge Over 'Modi Like... - Live Law,Delhi Court Issues Notice On Plea For Criminal Action Against Mallikarjun Kharge Over 'Modi Like... Live Law,,Live Law,2026-02-18 08:00:00,,https://news.google.com/rss/articles/CBMi8wFBVV95cUxPenQ5WkgxcW4xS1NzcnZzSUl6Zi1JTzgxaTY0emNsdEg1ZUk1bHpyNnJDNnFTdFBQY3h6MElVc0lXdTZzTFA5XzdvNGJRdDNrNWFVNS1nU0lyR1JGTzZUR3B5aUE0cU5Yd3VreHJxR3l0dmkyd2cwZ1FTU2w4RFNFYmZueHotdk5IbkdCcWVycGRrMGc0SWFzRHp0NmMxV29jclNGTzE5c2JBbEs1ZE95VE1TclBDRi1BUWFIN25LTmlkSjRCczR4dlM0aEZhWEdxd1RPZGxRY1ltV3AtZUVSMmZVM2xydG9oZUVwaC1JaVV1UnPSAfgBQVVfeXFMUDc3TFN2WUFhVWJKWlNNcDdkdjIyanZoVnRCaFNtZUhMamp6NDlnUFF6MGdweVRTTGZFMm5TaG1rS0xpcTVlZ1RvcjFIRGZCX1ZXdGRXN3NaUnpUYnMyVnREbTJoM1VuNlJuTnZhVmFGLVIyUHk3YjlqQ2ZrMFJ3TloyelNMRDNTQ3hxV2thWXB3cU9kN1JwLW5rcmNTNUpSSkxtYlhpdXJ1aUtYY1luYjZMUXFHbTZmOGdXaDNKUU5PUWNpMmFCZ09RWXloWld6WEM4TTJYa2l4LVl6QUZ4dDc3UjROUDF2YW1xLWZiOGdScVF1R2Y3Qmk?oc=5,2026-02,February,8,Delhi Court Issues Notice On Plea For Criminal Action Against Mallikarjun Kharge Over 'Modi Like... - Live Law Delhi Court Issues Notice On Plea For Criminal Action Against Mallikarjun Kharge Over 'Modi Like... Live Law,delhi court issue notice plea criminal action like live law delhi court issue notice plea criminal action like live law,20,5,Topic 6: com / speech / call,0.13556028594287725,0.00039445150093699944,0.0,0.0,0.009392992757221432,0.0,0.13556028594287725,0.0
Modi,“India should be among the top three AI superpowers globally”: PM Modi sets 2047 vision - PM India,“India should be among the top three AI superpowers globally”: PM Modi sets 2047 vision PM India,,PM India,2026-02-17 08:00:00,,https://news.google.com/rss/articles/CBMixwFBVV95cUxOM0xFaVpjN2ZFNUJfVHlVZ3Q4T083RlVPOEtrYW5KdXpsdnhOOFFMZndrc0ZHQmxkZnpXbXdVWjFicF9lVWczNmF1QUYwdmRTNmU0MDJKYURWMlhkM3hkVUZmdUxEOF8zb1ZPOURZRWh2ZDd3R0FodF9uMTNYZ2I3UHF0aU9Ka1VscHFpZmFZN0ZFY3htcVdwVjdLRGtOWFd3Ti1DNXBFZHE0RnFEY3ZUVXpGYk44TVQ0a2t6RnBocFVGV0RTbUhR?oc=5,2026-02,February,8,“India should be among the top three AI superpowers globally”: PM Modi sets 2047 vision - PM India “India should be among the top three AI superpowers globally”: PM Modi sets 2047 vision PM India,among top three superpower globally set vision among top three superpower globally set vision,14,3,Topic 4: indian / express / indian express,0.017596024555813685,0.0,0.0,0.0,0.017596024555813685,0.0,0.010970861534241285,0.00037070811500583133
Kharge,Karnataka BJP chief Vijayendra slams Priyank Kharge over RSS remark - ANI News,Karnataka BJP chief Vijayendra slams Priyank Kharge over RSS remark ANI News,,ANI News,2026-02-16 08:00:00,,https://news.google.com/rss/articles/CBMixgFBVV95cUxNanFVcllpc1VQZmU1WnZVZDVFeHJWRW5uYzVfX1VqLW9HMXpoekhlV3VJX0hiTkN0eDZWbXZtb0RRakMwc0JTZEtPREMwU3VfcTZYbDloalFac0k5bHNYc1ZacEkxLU5IaHBfbFVIcVZmYWFlMEZLVU5jeXVhNG5Jb3gwcVVLbjgtcWxYUnpfb1phVXlWV1hvQkhwVlpVdFVZLWp2eHdFSlQweWlkQ0Nsdy1ic19iWXhzaUFuVXgwSG9nVjduQUHSAc4BQVVfeXFMT0I0X21zZzd2Z3B4RGJpLWx4cm4xdHNzby13cG5ud2w0czRwZ0I3cWpjVHZocWJtN0dkMTVVQ3lzeHFtdFBBZnhKc201XzdUbHVkbjIxU3ZOYVdYemI1WGh6Z1cwYk1BS3c0MjJhN0hRUGZ6VVdwN2ZmZUluVmt6LXlhbThWTjd4dGpwcDRDNk5ob3ZsNVRpQjJvUjBHSkpGTjJQNHA4M19pV2o3UnBhRGJxR05COWF1TnVpM3RZRlRvZS13akVKVVBlYmUtVGc?oc=5,2026-02,February,8,Karnataka BJP chief Vijayendra slams Priyank Kharge over RSS remark - ANI News Karnataka BJP chief Vijayendra slams Priyank Kharge over RSS remark ANI News,karnataka chief vijayendra slam priyank rss remark karnataka chief vijayendra slam priyank rss remark,14,6,Topic 7: deccan / herald / deccan herald,0.12950380259040123,4.057459301185833e-05,0.0,0.0,0.029278368883075098,0.0,0.0414397369005368,0.12950380259040123
Modi,"After 5 years, PM Modi to return to Brigade Parade Ground for mega rally as BJP sets eyes on Bengal polls - The Indian Express","After 5 years, PM Modi to return to Brigade Parade Ground for mega rally as BJP sets eyes on Bengal polls The Indian Express",,The Indian Express,2026-02-16 08:00:00,,https://news.google.com/rss/articles/CBMisgFBVV95cUxPZTNfRWV0Y0RzaXE5QzFLNlc4ZDUtVlFiZ3dmSzA5TlZDbkFkOTVNR3cxYmNfMk5hYy1GM29fVlJlR0pickRSY0FlMVpYcWgtclZ1MEY5NmhseE1IalhXalRBNHJrV2htMHd0WHhVZ1pHdm9USnVHeU5jUnc0VFNKQ1lvRHdWZC1hNmFsZTJVXzgwVXp3WFNUT0Y2UkZCZVZQMXlSTXBqNGNPMEFnVFhRWURR0gG4AUFVX3lxTE1PbG1CNkhlb2o1NUhsUHoxZVYxOHlzdk5NQTNkemRJTWd0ZHZJaXBnTEpwVlBYQUUtU0Zsb3dhc1Q5eTBNbExsNkY3TkJrQ25aVmJuSUdqSUhNS1ZHWlBOdGRGSS1Ya2dXVTdkdzNOR0NHTGZ4NUxjVDJoQk5ZS2VoUDZ3LV9vWi14UzBObmJRcUVmN2F1NDJjYXBnNlFHbFFIWmk4aDNUM0ZRZW43QXc4bWp2Q2JhSEo?oc=5,2026-02,February,8,"After 5 years, PM Modi to return to Brigade Parade Ground for mega rally as BJP sets eyes on Bengal polls - The Indian Express After 5 years, PM Modi to return to Brigade Parade Ground for mega rally as BJP sets eyes on Bengal polls The Indian Express",year return brigade parade ground mega rally set eye bengal poll indian express year return brigade parade ground mega rally set eye bengal poll indian express,26,3,Topic 4: indian / express / indian express,0.3216895902065368,0.0,0.0,0.0,0.3216895902065368,0.03346184842214743,0.0454588790716615,0.0
Kharge,Video: Kharge’s ‘Hyderabadi Pareshani’ remark stirs debate - The Siasat Daily,Video: Kharge’s ‘Hyderabadi Pareshani’ remark stirs debate The Siasat Daily,,The Siasat Daily,2026-02-14 08:00:00,,https://news.google.com/rss/articles/CBMijwFBVV95cUxPSC1FTGtORDl6Skc2OHJyamMybWxsbS1XRFdLZURCTWlGQlJEbG5RVUZSNnFIeHhkT1FIa01TVDZtUjRNNVhieGhkZF9wOGdwanlBdU1hQUtldzR4X0g4N0VTTDNteFljZ01IWVgxZGRzb0xUZDcyeFpLZ3kwYzZyOHJiTENkbWJFbS03THh6VdIBlAFBVV95cUxOSVVGUmhieXVralNBc2EwQTJqYVBIMEhtMWRNTlZYU19vOGtxekMwYlY5RTVSWnQ3c0RaM2hEaW9lZnp6cGZKRGlTdDYxcDdPNm1Uc0dvcVBQR0dzbV9ET0JKRTMwQzdZWnJkbzNzZF9VZ3lMbm1OODFvR1R4Sjg5NG1xRWVWYi1DYVg1RG9iaGl3TWpf?oc=5,2026-02,February,7,Video: Kharge’s ‘Hyderabadi Pareshani’ remark stirs debate - The Siasat Daily Video: Kharge’s ‘Hyderabadi Pareshani’ remark stirs debate The Siasat Daily,hyderabadi pareshani remark stir debate siasat daily hyderabadi pareshani remark stir debate siasat daily,14,3,Topic 4: indian / express / indian express,0.031871422721275584,0.0,0.01126262460992415,0.014589409939406427,0.031871422721275584,0.0,0.0,0.028934248789831234
Kharge,Kharge Demands Restoration of Expunged Rajya Sabha Speech; Chairman Rejects Plea - Daily Pioneer,Kharge Demands Restoration of Expunged Rajya Sabha Speech; Chairman Rejects Plea Daily Pioneer,,Daily Pioneer,2026-02-14 08:00:00,,https://news.google.com/rss/articles/CBMijwFBVV95cUxQSHoyTzVvQW9oOTVfMDRjRGdWN2dCNHRKRW5qWnUxaVlGODMtMTZuTWNZak1JX2JaLURBZEJPY3BpWVlhVTk5cHhGX2NEYkR3YzJGa1RCRGxfelY2M2FUTVF1OE9CNVQwTXYtZ1U0bXhZQzZZdGZnRTNTZHFFU1lFbjV0VjZxVnFMVkhvZkluTQ?oc=5,2026-02,February,7,Kharge Demands Restoration of Expunged Rajya Sabha Speech; Chairman Rejects Plea - Daily Pioneer Kharge Demands Restoration of Expunged Rajya Sabha Speech; Chairman Rejects Plea Daily Pioneer,demand restoration expunged rajya sabha speech chairman reject plea daily pioneer demand restoration expunged rajya sabha speech chairman reject plea daily pioneer,22,1,Topic 2: sabha / rajya / rajya sabha,0.23485072136279958,0.0,0.23485072136279958,0.0,0.04925206894018498,0.0,0.016138417849030202,0.0
