Speaker,Headline,Summary,Author,News Source,Published,Tags,URL,YearMonth,Month,Week,Full_Text,Clean_Text,Text_Length,Dominant_Topic,Dominant_Topic_Label,Topic_Confidence,Topic_0_Weight,Topic_1_Weight,Topic_2_Weight,Topic_3_Weight,Topic_4_Weight,Topic_5_Weight,Topic_6_Weight
Modi,132nd episode of Mann Ki Baat today: PM likely to address West Asia war; mentioned AI Impact Summit last time - bhaskarenglish.in,132nd episode of Mann Ki Baat today: PM likely to address West Asia war; mentioned AI Impact Summit last time bhaskarenglish.in,,bhaskarenglish.in,2026-03-29 02:44:00,,https://news.google.com/rss/articles/CBMirAFBVV95cUxPcXlkMjByd05SdlphLWdVR0NudGlXckEwelM5Q0ZYUFNTSlphMWdOWmxmRTltVEE1X3NXSC0xLS1SM3E4RmZDejdoWkN2aTZfdEMwQ2Jab3FwYWZuYW4zaHJmT0llNnNOSV8yOUVSRVY1aGJTRm5lX3VmV0xpQ2Y0Z0VyT1AxNTRhZHhqR0I4b0htMmtFWTY4eWxabEJQNUhnMU84czQ4UkZzT3Vq0gGyAUFVX3lxTE1jRWlnT21sYzc4RENjRnJkV204WkMxalNPLVNkbG9GdGlySk9hd1RVa0tvbUhBcVBrVWNDRW1sa3E1bHJnMEpTUjhlczFJaXBER2ZBN3BiWi1UWDRrM2FaZVF6bXB1Y244X05Cb2RDa0czR2JvSTZRSHgtZ01aVXRuNGNfcHV1NUtFcFY1SGtMUXBYeWRRa1plVXhhSGhKODV6Z25FZnZhalh1bzVPT3VoaFE?oc=5,2026-03,March,13,132nd episode of Mann Ki Baat today: PM likely to address West Asia war; mentioned AI Impact Summit last time - bhaskarenglish.in 132nd episode of Mann Ki Baat today: PM likely to address West Asia war; mentioned AI Impact Summit last time bhaskarenglish.in,episode mann baat likely address west asia war mentioned impact summit last time bhaskarenglish episode mann baat likely address west asia war mentioned impact summit last time bhaskarenglish,28,2,Topic 3: west / west asia / asia,0.20440614571611743,0.09699521397427688,0.0,0.20440614571611743,0.0,0.07690173360643039,0.0,0.0
Modi,PM Modi speaks to Crown Prince of Saudi Arabia; discusses West Asia situation,"In his telephonic conversation with the Crown Prince of Saudi Arabia, the Prime Minister also reiterated India's condemnation of attacks on regional energy infrastructure",,The Hindu,2026-03-29 01:00:00,"West Asia conflict,PM Modi speaks to Saudi Arabia Crown Prince,India Saudi relations,Israel US strikes on Iran,pm modi mbs call on iran israel war",https://www.thehindu.com/news/national/pm-modi-speaks-to-crown-prince-of-saudi-arabia-discusses-west-asia-situation/article70796544.ece,2026-03,March,13,"PM Modi speaks to Crown Prince of Saudi Arabia; discusses West Asia situation In his telephonic conversation with the Crown Prince of Saudi Arabia, the Prime Minister also reiterated India's condemnation of attacks on regional energy infrastructure",speaks crown prince saudi arabia discusses west asia situation telephonic conversation crown prince saudi arabia reiterated condemnation attack regional energy infrastructure,21,2,Topic 3: west / west asia / asia,0.2646779617545534,0.0,0.0,0.2646779617545534,0.0,0.0,0.0,0.008098444664015414
Modi,Two Odisha achievers find mention in PM Modi's 'Mann Ki Baat'; CM Majhi expresses gratitude - thehawk.in,Two Odisha achievers find mention in PM Modi's 'Mann Ki Baat'; CM Majhi expresses gratitude thehawk.in,,thehawk.in,2026-03-28 22:25:00,,https://news.google.com/rss/articles/CBMivgFBVV95cUxNY2dUNnVOajFoS1VSQmVVNDVvb2FlSUoteFZiTmJVaWxJRU9WTjRyNDdpQk1tMEItNWZHOTg1SnZQbHVSNFk0U0F6WXd1WElYaEVUQ3ZnLXlQQXUtY3FNY3lveDU2SE9iSmpOV0VxZjY2TWxyTmpQXzNFTTc5VlhhVV9sanY4NHhVWDV2eEFiN0prSkUzYUxtZDl3MVNud0VENzNDdDhzVVJ2Q3FFQ0NKbWFPXzZoS1dOTzBXWVhn?oc=5,2026-03,March,13,Two Odisha achievers find mention in PM Modi's 'Mann Ki Baat'; CM Majhi expresses gratitude - thehawk.in Two Odisha achievers find mention in PM Modi's 'Mann Ki Baat'; CM Majhi expresses gratitude thehawk.in,odisha achiever find mention mann baat majhi express gratitude thehawk odisha achiever find mention mann baat majhi express gratitude thehawk,20,0,Topic 1: baat / mann baat / mann,0.16286673791971415,0.16286673791971415,0.0,0.0,0.1158399870041315,0.0,0.0,0.0
Modi,"‘Honoured, motivated and proud’: Sambalpur fish farmer on PM Modi’s ‘Mann Ki Baat’ praise - thehawk.in","‘Honoured, motivated and proud’: Sambalpur fish farmer on PM Modi’s ‘Mann Ki Baat’ praise thehawk.in",,thehawk.in,2026-03-28 21:30:00,,https://news.google.com/rss/articles/CBMiywFBVV95cUxQNFQ0YndpX0czeXdOOEFTU19rMWc5S0ZDTUpHRjgxTTRBaDBNbmdoZ0lFdkVQWXZYU2lrdWJ0WmlCYzJMcG9aa1ZpZEktNFlSSEpoVVVhZ1JpNTNVYXpXMVluOFAzWUFfOUU0aWxrX0JHMFp3NnZEUW00Z21Oc21QZW91YTFING1kcE5FS2wybUVWeVQ1azFkci1Ma1dLcWk4by1kMnlxbjBydlFRM0ItVkJLUElBNHNIZ2JfWXgwd2JUeWhtNHhxM2lHTQ?oc=5,2026-03,March,13,"‘Honoured, motivated and proud’: Sambalpur fish farmer on PM Modi’s ‘Mann Ki Baat’ praise - thehawk.in ‘Honoured, motivated and proud’: Sambalpur fish farmer on PM Modi’s ‘Mann Ki Baat’ praise thehawk.in",honoured motivated proud sambalpur fish farmer mann baat praise thehawk honoured motivated proud sambalpur fish farmer mann baat praise thehawk,20,0,Topic 1: baat / mann baat / mann,0.14513096848511453,0.14513096848511453,0.0,0.0,0.002611612540412892,0.0,0.0,0.0
Modi,Prime Minister Shri Narendra Modi Shares Glimpses Of His Address At The Inauguration Of Phase I Of Noida International Airport. - TRIPURA STAR NEWS,Prime Minister Shri Narendra Modi Shares Glimpses Of His Address At The Inauguration Of Phase I Of Noida International Airport. TRIPURA STAR NEWS,,TRIPURA STAR NEWS,2026-03-28 20:08:00,,https://news.google.com/rss/articles/CBMi8AFBVV95cUxQWnp0a1psd0V3UUhmU1hmbjkwRE9fYVN1aXZvMTdmWXJ1NVdKNy1WSXFTQ0VIUVlydG9IODJNeldBR3BzNC1GRGJqQUkxSU0yWXlFYzlFUGJPWi05eVZ1c3NJWEN2aENGZFFTWXFOSmZ3VmtIVjJGNHpzcjN5amNXRDR5aUpPYVBxRXJ1UkNiRXdPU2lPa01JYkNQMTRJd0FQaG56c3RiMmpYeDRyS1ZJSHQ2Z09MT2dURzBaY1dXU1dZTTRGalBzVGdMb1FZTngtWjB2d2VFcTB5QnJOdm1kaFU0YWlVUi0tdTRnZ21kOFc?oc=5,2026-03,March,13,Prime Minister Shri Narendra Modi Shares Glimpses Of His Address At The Inauguration Of Phase I Of Noida International Airport. - TRIPURA STAR NEWS Prime Minister Shri Narendra Modi Shares Glimpses Of His Address At The Inauguration Of Phase I Of Noida International Airport. TRIPURA STAR NEWS,shri share glimpse address inauguration phase noida international airport tripura star shri share glimpse address inauguration phase noida international airport tripura star,22,4,Topic 5: address / march / assam,0.10812282385948108,0.0,0.0,0.0,0.0,0.10812282385948108,0.03500209277394831,0.0
Modi,"PM Modi's 'Mann Ki Baat' played key role in promoting Uttarakhand's tourism potential, says CM Dhami - thehawk.in","PM Modi's 'Mann Ki Baat' played key role in promoting Uttarakhand's tourism potential, says CM Dhami thehawk.in",,thehawk.in,2026-03-28 19:37:00,,https://news.google.com/rss/articles/CBMiyAFBVV95cUxPanZQUzBReERvWml4UnVkOTZpUW8ta1lVWFZ4WG0wNDIyTWF6cTl0OUZTUjlIcUtydHBUaGJ3ZXFsMnZTNVRnMUtCMzBETVFzYl9Mc2xrejlWLTh6VHpKNFN3M2pSUGtYSkxkYVBzek9INTVJWTZhUmpZUE4zLTRISGU5d3ZJYmhCcERCWGlfT2xFSmkzSlRzRWdicDFKMDExTk40TzBzbU8yb2E4REpSeUgzLTZOTVdQZURHVzdwc3ItY1U4dXIyNg?oc=5,2026-03,March,13,"PM Modi's 'Mann Ki Baat' played key role in promoting Uttarakhand's tourism potential, says CM Dhami - thehawk.in PM Modi's 'Mann Ki Baat' played key role in promoting Uttarakhand's tourism potential, says CM Dhami thehawk.in",mann baat played key role promoting uttarakhand tourism potential dhami thehawk mann baat played key role promoting uttarakhand tourism potential dhami thehawk,22,0,Topic 1: baat / mann baat / mann,0.09462572029089245,0.09462572029089245,0.0002540718019493617,0.0,0.0,0.0,0.0037271260034502244,0.0
Modi,"Across states, leaders tune in to PM Modi’s 132nd 'Mann Ki Baat' - thehawk.in","Across states, leaders tune in to PM Modi’s 132nd 'Mann Ki Baat' thehawk.in",,thehawk.in,2026-03-28 18:57:00,,https://news.google.com/rss/articles/CBMimgFBVV95cUxQc3BHLVNyN0xlaFlHOHhXQTFKNVVsbGJ2ekRvT2JoQmFVckJWWTEyTzhKNUF6a2c5Tlg0cnA0RXdxeUo2YlFjWldMWWhfZGxZMUJ2MEVrS0pqOXlGRENmdW9wdWxKWU43XzBGQWJOSTdOSXZfU0t2ZndfNG1RanFwOTRxRHUzOUsxSmRhVkFRZGtEd1VpUlpLWTV3?oc=5,2026-03,March,13,"Across states, leaders tune in to PM Modi’s 132nd 'Mann Ki Baat' - thehawk.in Across states, leaders tune in to PM Modi’s 132nd 'Mann Ki Baat' thehawk.in",across state leader tune mann baat thehawk across state leader tune mann baat thehawk,14,0,Topic 1: baat / mann baat / mann,0.15493185986753916,0.15493185986753916,0.0,0.0,0.003046954321039589,0.0,0.0,0.0
Modi,"Prime Minister Shri Narendra Modi's 'Mann Ki Baat' programme will air on March 29, 2026, at 11 AM. - bjp.org","Prime Minister Shri Narendra Modi's 'Mann Ki Baat' programme will air on March 29, 2026, at 11 AM. bjp.org",,bjp.org,2026-03-28 17:47:00,,https://news.google.com/rss/articles/CBMiswFBVV95cUxPUHl4MUJlLUV0cGNQbjBCb19UeWpVbVlBQ19BRWdsb2NLM0lnX3ZaakgxT3lIQ0V4SlE3aUtJc0NUWWJMNnBrd1JNRGRFMlhlUGlGZ0dnT0tDR0FhUjNRRG9YVVBCVTBWZTNKd2dvRWl2eGF0SjY4czZueEUyazdxeUd6aTlPcEdSa0FPRjR3LTVzVlZMSWkyWkxyWTRQTVQ2N0VvOVVwbkJaTlUyb3c3d1hNSQ?oc=5,2026-03,March,13,"Prime Minister Shri Narendra Modi's 'Mann Ki Baat' programme will air on March 29, 2026, at 11 AM. - bjp.org Prime Minister Shri Narendra Modi's 'Mann Ki Baat' programme will air on March 29, 2026, at 11 AM. bjp.org",shri mann baat programme air march org shri mann baat programme air march org,14,0,Topic 1: baat / mann baat / mann,0.16701073097593688,0.16701073097593688,0.0,0.0,0.0,0.10830295448220593,0.0,0.0
Modi,"India 'resolutely facing' energy challenges, says PM Modi on West Asia situation in 'Mann Ki Baat' - thehawk.in","India 'resolutely facing' energy challenges, says PM Modi on West Asia situation in 'Mann Ki Baat' thehawk.in",,thehawk.in,2026-03-28 17:24:00,,https://news.google.com/rss/articles/CBMixgFBVV95cUxNM2laOFE2cHlyX3lKNHhzUWFaNEpROEdsYlJJWVNlQjJSeFQzdklxOXZpaVh4RUk2cDg5YmpVWEt1ODB2OTJFdUZ1QXFlRjRUdWJyZW84M053bi1RS2lkZUpDY2FCRmZfdC1tWmpyMXR6ZWpfZ0JEalFDTlZLcUpvdWFLcC05RS1fY1pEX3RRWGdDRU03U1ZhUTM5SldxTVRIQ3V5Tlc0V3FfRGdGbF95Z1MySTBtNHh4V1J3bmZwdHFuMjhVTWc?oc=5,2026-03,March,13,"India 'resolutely facing' energy challenges, says PM Modi on West Asia situation in 'Mann Ki Baat' - thehawk.in India 'resolutely facing' energy challenges, says PM Modi on West Asia situation in 'Mann Ki Baat' thehawk.in",resolutely facing energy challenge west asia situation mann baat thehawk resolutely facing energy challenge west asia situation mann baat thehawk,20,2,Topic 3: west / west asia / asia,0.22929027637060392,0.1078619584747335,0.0,0.22929027637060392,0.0,0.0,0.0,0.0
Modi,PM Modi Speech: Key Highlights You Can’t Miss | Jewar International Airport - Moneycontrol.com,PM Modi Speech: Key Highlights You Can’t Miss | Jewar International Airport Moneycontrol.com,,Moneycontrol.com,2026-03-28 15:05:00,,https://news.google.com/rss/articles/CBMi0gFBVV95cUxQdVJxaUpnd0JmYy1HRGY2WEhoaFp2RnpmSlFSVERlWmkzUE1vZG5CVDlFNGY4Qnhsb0t6RjZEY3A5WVBsV1M0TEM1M0t3OHZZUkNOS2w4M0pESHZGZ19ORlAwcFAwZk5ldmdXWHJiVnJmTFU0UkZEMmNnbGZXWFNpcmhlSGw3ZjVZbWtKUUlJaXd3dHVrZ0lZSXNJSFUtUFFONFlKOWRpdmdxN3oyZlZ2TkZxTldpcmUxaXFnVFhtWlFIU1o5UERtV2Jfd0F6dHVZb0E?oc=5,2026-03,March,13,PM Modi Speech: Key Highlights You Can’t Miss | Jewar International Airport - Moneycontrol.com PM Modi Speech: Key Highlights You Can’t Miss | Jewar International Airport Moneycontrol.com,speech key highlight miss jewar international airport moneycontrol com speech key highlight miss jewar international airport moneycontrol com,18,5,Topic 6: com / speech / call,0.1652696755379812,0.005300613512812476,0.03288315512877607,0.0016712770195940754,0.0,0.002025796671472305,0.1652696755379812,0.0
Modi,"PM Narendra Modi Inaugurates Noida International Airport at Jewar, India’s Largest Greenfield Airport Project - Indian Masterminds","PM Narendra Modi Inaugurates Noida International Airport at Jewar, India’s Largest Greenfield Airport Project Indian Masterminds",,Indian Masterminds,2026-03-28 14:54:00,,https://news.google.com/rss/articles/CBMipAFBVV95cUxOb04tT21OSDRJLU1VQjRhdmFPTGw4RUxDcW5fR0J5OTdtRXMtM2c4akhoWkdQUjlza2pJdjkxQUpEcGpGZGo2dXoyeHozak5ETFJ3VjNMODR2YkNZcGZMbzY0WG1OU2NqVTVqNUUzSlJaTEdFWm1ob3g3bTM3eW9odUFHdUJTV0c3dVNBZktqMzE1MlltdEs1LUxLc1VnOEpuLWdVWg?oc=5,2026-03,March,13,"PM Narendra Modi Inaugurates Noida International Airport at Jewar, India’s Largest Greenfield Airport Project - Indian Masterminds PM Narendra Modi Inaugurates Noida International Airport at Jewar, India’s Largest Greenfield Airport Project Indian Masterminds",inaugurates noida international airport jewar largest greenfield airport project indian mastermind inaugurates noida international airport jewar largest greenfield airport project indian mastermind,22,3,Topic 4: indian / express / indian express,0.08223903605877336,0.0,0.0,0.0,0.08223903605877336,0.007118155188980112,0.04272445448620798,0.0
Kharge,Congress Chief Mallikarjun Kharge To Release Assam Polls Manifesto In Lakhimpur Tomorrow - Northeast Today,Congress Chief Mallikarjun Kharge To Release Assam Polls Manifesto In Lakhimpur Tomorrow Northeast Today,,Northeast Today,2026-03-28 14:20:00,,https://news.google.com/rss/articles/CBMiywFBVV95cUxQSU1neUgtRWxuYmNaVUlNeGZpWXJ3V3J1bFc4ZHFHVWNqeHM1NVBnVjRJcW82cHl3dEd4WlY3bGxWaXVycGtqd1YzWWxCazdJZ2ZIcTRjbVJzT1gyRmQ0a0VReDMyZHh0RFFzRlpiUmhKdFpzOG1POTZTM004VEtsb0VSdktKbGFoOUpJZFg5YlJ5NzJyX0owcm53S0k4bHRud2xtU296QzZTUFJnZzl4ejlkbjJxUzRqbEFjTGxKYkhKMGdhelV1cTJkRQ?oc=5,2026-03,March,13,Congress Chief Mallikarjun Kharge To Release Assam Polls Manifesto In Lakhimpur Tomorrow - Northeast Today Congress Chief Mallikarjun Kharge To Release Assam Polls Manifesto In Lakhimpur Tomorrow Northeast Today,chief release assam poll manifesto lakhimpur tomorrow northeast chief release assam poll manifesto lakhimpur tomorrow northeast,16,4,Topic 5: address / march / assam,0.12030529704446605,0.0,0.0,0.0,0.032833272769746624,0.12030529704446605,0.0,0.014222532334870077
Kharge,Kharge to release Cong's Assam polls manifesto on Sunday - The New Indian Express,Kharge to release Cong's Assam polls manifesto on Sunday The New Indian Express,,The New Indian Express,2026-03-28 12:26:00,,https://news.google.com/rss/articles/CBMiswFBVV95cUxQbWxCR2dldDlTNGpCRTJpUEZHZmk1dW9sZnBLV05JUlpvc0Z5eU5TdlNhdWgzY0I3Xzl2R1IwbFZSSjFINmZqVFVqM2c5dlFIOTdZVTZmSGIzLUpjeTRmbldXTF8tYkplNUJiSEtGYkdvUnFXWWJfa2VIdVd6bEJadTlfTDBaSUMtNFVuVVV0NzdzQ050b2JsVjFzY3pVeXdNcFFuSHc1LV91Ry1kRTRLeFdSRdIBwAFBVV95cUxOV29IRW9UT0RyS0lzMXFjNEpqMERWV2huZlVTaWQzN2JBd3J1R1VnVkhYSUc0LXczZDR1M0ZNV0Z5YVkxTThRam5hQWJzVW1ZTHBTX0NkMzVPLWZaNW0zVlVUOE5qdEswNTdONlVFZnkyUFVwakstNFlwVWx4N3VQa0c3OFd5bXlxSFRmNG45ak9DMmpBUUxmQVV0cy1ocm5qd0h1MEhlb19OYjRMa0VLeDB3dlB2ODdHV2JibnFESUc?oc=5,2026-03,March,13,Kharge to release Cong's Assam polls manifesto on Sunday - The New Indian Express Kharge to release Cong's Assam polls manifesto on Sunday The New Indian Express,release cong assam poll manifesto sunday indian express release cong assam poll manifesto sunday indian express,16,3,Topic 4: indian / express / indian express,0.2692057809679236,0.0,0.0,0.0,0.2692057809679236,0.10539440910076613,0.0,0.0
Kharge,Kharge to release Cong’s Assam polls manifesto on Sunday - Daily Excelsior,Kharge to release Cong’s Assam polls manifesto on Sunday Daily Excelsior,,Daily Excelsior,2026-03-28 12:08:00,,https://news.google.com/rss/articles/CBMikAFBVV95cUxORzVQT25NWV9FNDROd282ejU5ODU0ZlJ3ck9ReDBzaGF0NzdNWWpnTXp3OTJ0c3Buc2xKRkdBX18xcjgzSXlpZE8zZHFuZElYUTFCZGJYdFNEcEUwYXNGQmYzSmMtenlWUEhDcGlGUUlIRkdBVm9rSncyYXlCVnEyOU1oZjRaLUl0Nk8yYUNDX00?oc=5,2026-03,March,13,Kharge to release Cong’s Assam polls manifesto on Sunday - Daily Excelsior Kharge to release Cong’s Assam polls manifesto on Sunday Daily Excelsior,release cong assam poll manifesto sunday daily excelsior release cong assam poll manifesto sunday daily excelsior,16,4,Topic 5: address / march / assam,0.11883923346652575,0.0,0.0,0.0,0.038887192123545196,0.11883923346652575,0.0,0.0
Kharge,Mallikarjun Kharge to release Congress manifesto for Assam Polls in Lakhimpur on March 29 - indiatodayne.in,Mallikarjun Kharge to release Congress manifesto for Assam Polls in Lakhimpur on March 29 indiatodayne.in,,indiatodayne.in,2026-03-28 11:51:00,,https://news.google.com/rss/articles/CBMi5wFBVV95cUxOTm0zQ2hQclFLZ1pLc0QtTm9ScmExWjlzWWlJbGI4WW9VV0hKaWNaNm4ya3QwRkFhQlhDOXVNTWpOLWRNdVVpZTdkMzdyWW9HU2tiSGFrRHVTQVEwbEJaNVRSVjM5dFljR3dTQTVzampxZ1Z1Q3piMlB0R3JZOFdqUGt2X1dHYTJ6SU1pckt6VTZIU2tqZUxYZmR3WVVjcnhQWW5CcE9HeXpTNGZ5aDIxYTI0X2txeTBWTjZyNHlWUmhNYXRnbkF6djNTaGVZbHB0UUNBR1NXVlpjbnBMd0VlYzVHc09FMGPSAewBQVVfeXFMUC1kRHdnUFhyVVhNbnYybjdUeHVqNXVrdkd5ZFlxZ3NsbXl0Z0xFYTRFaHB1RVR3OGp6aGJyRnhCeHpoNDM0bFNsaGhvS202aWwyQ2p1bUtsR0MwVFg4NGpxY2twbTVCWmJpRTRmM2syVzJyZ190UFpRcUdzWEtpRkQ2cGh0dXlqM2dlZG5TNTl2YktwaE1tS1VWTENnckdLaWNOOEV6Q3JCSDB2UndyTWdpUFNTVnY3RGcxU1JrOXJPVjJ3VG9LdlNwb0lTNWRrZ0d6ZHIzZldzdjVCckRQZ3V1WC05bVhmMU5BMzM?oc=5,2026-03,March,13,Mallikarjun Kharge to release Congress manifesto for Assam Polls in Lakhimpur on March 29 - indiatodayne.in Mallikarjun Kharge to release Congress manifesto for Assam Polls in Lakhimpur on March 29 indiatodayne.in,release manifesto assam poll lakhimpur march indiatodayne release manifesto assam poll lakhimpur march indiatodayne,14,4,Topic 5: address / march / assam,0.18277346237421183,0.0,0.0,0.0,0.03186859538706568,0.18277346237421183,0.0,0.0
Modi,"From 2004 to 2014, it remained buried in files: PM Modi slams Congress, SP of delaying Jewar Int’l Airport project - Organiser","From 2004 to 2014, it remained buried in files: PM Modi slams Congress, SP of delaying Jewar Int’l Airport project Organiser",,Organiser,2026-03-28 11:05:00,,https://news.google.com/rss/articles/CBMi7wFBVV95cUxQS0QyanhHRWdtM0FQbnV2eUwxUzlkVlhnYnNLUXJEdmYtSTk1TjBsZnRxVEllbWlzOVdwWVhjbnVLaVA4blM5Rlhxa2EyNjFqcGVidWVwTzAyRno1dnRlalBzZExCWEF5aUt4T050SFdRb3lLMFRGMThqS09UTDFoeTRObWVjd0dNOXhJZTVDV0M0dHdEVk05azU2aG9jcXFHMDV0UGVzNGdTVE94aXd5Q2w0SUFlM01KNmxnVUtYSFJUWGlYOENvV0ItLTE4NnNyb3Z6OHAwbk01MEV1TEJxYWdVbHJ4aFZ3MENDS1h0a9IB9AFBVV95cUxOdk5MeXhjWktIQ2IwdE9RQ2VOS3RKTGkwdjY1Y2sxRlJmbUJ0Z1gydF9HZ0J0Z2ltaHBpMHVTNnQ1aGo0SjlSQ0lRRmFpMVZpOFlqRHVsOVVVY211eWFFX2s3RkpCYWk3a1k3Y1l4ZEZOaHFUNE1UNjNYVGVNb1BWbW1qUnVSMkhLa09nem9WQzYxdW1Ga2JPcGtubDdRanY5Yml4S1EwNnozd0RkYjVwUUphTy1WU1RxbTlpc0RFUzBTdVFRX0g0OWFVeFpPWFNlbmczX2l0NklhYTBIWmc5bmZQVWxPOUxJSjZCSGp6YzdRUkdD?oc=5,2026-03,March,13,"From 2004 to 2014, it remained buried in files: PM Modi slams Congress, SP of delaying Jewar Int’l Airport project - Organiser From 2004 to 2014, it remained buried in files: PM Modi slams Congress, SP of delaying Jewar Int’l Airport project Organiser",remained buried file slam delaying jewar int airport project organiser remained buried file slam delaying jewar int airport project organiser,20,5,Topic 6: com / speech / call,0.05461238742107394,0.0,0.0,0.0,0.0,0.003178045717428533,0.05461238742107394,0.04320577861118021
Modi,"PM Modi says India facing West Asia crisis with full strength, cites ethanol blending easing oil imports - The New Indian Express","PM Modi says India facing West Asia crisis with full strength, cites ethanol blending easing oil imports The New Indian Express",,The New Indian Express,2026-03-28 08:52:00,,https://news.google.com/rss/articles/CBMi6wFBVV95cUxQNHM3TEtGc2hTYU5MWFhyVERDSm5QRjQ2OUtkcXQ1VmViYVBCR3NfNEtGRTRVYzYxUFdXNkpENU8zTGxIcTE5ZG1qSS13SlhabFBxR0J4ZE00NUdfT1NyNzBSM1FuLW9QVDZfUTRoeW02WHNQcVA5ZmcxOG1jb0ZlQVZJZlA4Vk1nVW11OFpkc3hYQ1VnSkc3MFQ3cjg1Q1U1RmZuMGxUNnZvczIzUE9MaWU5Nmp6TE43V2ItSFlVVDgwUzNfc1l0cXl4dUo5and1Tk52UlJSSy1CTXgxdU9YWTBfWDNZUl8yR3dz0gH4AUFVX3lxTE1pM1lhbHFSU1M3dzRnWU9nOEJ2d0ZRT2xsUWxqWXVNS2RRNjJuaUZ4OGF5V3pqcVBnVWxrNUxTQlpKYTJ3MDd1dnpTSS1XYnlndzhkZ09jZ1hFcVNkUlhkWGxhbnJ1cFB5NzN5VXdKRmM1Qncwa2xQbmYxV09EYU1qd0UyZ2VWRDJKUmZZUDZLSlRScjVXWmRpamlpVV9nVXg5NFQzcmh1MlE2YVh6bnBpamdNWkloaWVmMWV4a25acm1odmJGX0VINGJuY014a00zc3E2dFlXR3FJMVRXZHZjTGR5czl3ZjB3ZVhOd3F5X0tkRTlaUnpr?oc=5,2026-03,March,13,"PM Modi says India facing West Asia crisis with full strength, cites ethanol blending easing oil imports - The New Indian Express PM Modi says India facing West Asia crisis with full strength, cites ethanol blending easing oil imports The New Indian Express",facing west asia crisis full strength cite ethanol blending easing oil import indian express facing west asia crisis full strength cite ethanol blending easing oil import indian express,28,2,Topic 3: west / west asia / asia,0.27986792137551986,0.0,0.0,0.27986792137551986,0.2458135626470305,0.0,0.0,0.0
Modi,PM Modi to Address Nation on Sunday via 132nd ‘Mann Ki Baat’ Radio Broadcast - Hindusthan Samachar English,PM Modi to Address Nation on Sunday via 132nd ‘Mann Ki Baat’ Radio Broadcast Hindusthan Samachar English,,Hindusthan Samachar English,2026-03-28 08:23:00,,https://news.google.com/rss/articles/CBMikgFBVV95cUxQd29sRU9QVXhtZFhRYzdRRmN6UUlXajZ0SGE3eVJNVmtMLVhSdkw0N2toS09LWTFmSUZHUlFDRm1ON1pKMXdRdUVIeG1JSHp3TFlXRWNFNkh4ZnpPRFlKTmlJTF9LVUZlMDV5ZWdLS1NBYm1IRksxQnFGUVR6bXA1RlA3QWpxaUNlQkQxNy1CMVZsZw?oc=5,2026-03,March,13,PM Modi to Address Nation on Sunday via 132nd ‘Mann Ki Baat’ Radio Broadcast - Hindusthan Samachar English PM Modi to Address Nation on Sunday via 132nd ‘Mann Ki Baat’ Radio Broadcast Hindusthan Samachar English,address nation sunday via mann baat radio broadcast hindusthan samachar english address nation sunday via mann baat radio broadcast hindusthan samachar english,22,0,Topic 1: baat / mann baat / mann,0.14373952501445783,0.14373952501445783,0.0,0.0019745607811495723,0.0,0.14294835432369846,0.0,0.0
Modi,India confronting West Asia crisis with full strength: PM Modi - DT Next,India confronting West Asia crisis with full strength: PM Modi DT Next,,DT Next,2026-03-28 08:15:00,,https://news.google.com/rss/articles/CBMingFBVV95cUxOVUM5SDRSaDZRbUVpN0c1M3lDazVPYkdDdUJWUVJWOTJUX05XcFdnbDc4clYtMDZVdU9ibEM5RWRBb1I5bWxBUU9faVI2RkhpVHVnY09yUEZ2VVF4eWlpODdCdzBoYjVoNzN3czNTTkFMXzE2dnBzczU4NnpiMEVIWUEtWDRUcXZtQ29VYXhRWVFMd2tNUjhrUTNPejY3UdIBqwFBVV95cUxNbldrdWVfTlM2cWJ3a0hGdTN2c1hGY2daMDRCNU5obWNUUDNCMjFFZDFWOVVOSGJfS3RWS0NRa1FOeklyUlllVGdsOTF5cU9BMzVkOWFQZlZ1QVRPRHp6d3VPNWtQRzJSYlN4LU53ejB2bkFUSkVETk5YYl8tN2xQdDUwMzlrS1Q5UlU0RUQ5alZ4NUJReUs3dXVsVmFFTzA0dHNhZHVhNFRTNkk?oc=5,2026-03,March,13,India confronting West Asia crisis with full strength: PM Modi - DT Next India confronting West Asia crisis with full strength: PM Modi DT Next,confronting west asia crisis full strength next confronting west asia crisis full strength next,14,2,Topic 3: west / west asia / asia,0.37524681655936126,0.0,0.0,0.37524681655936126,0.0,0.0,0.0,0.0
Modi,"Assam polls: PM Modi bats for NDA, says state ready for five more years - The Assam Tribune","Assam polls: PM Modi bats for NDA, says state ready for five more years The Assam Tribune",,The Assam Tribune,2026-03-28 08:06:00,,https://news.google.com/rss/articles/CBMirAFBVV95cUxNVzctQ1VzN3pPQi1pVmFwNXlVeHNPdTM2ckpobWNZVkZDQmQ5ME4yX0oxMHVQR2lIdFB2cUlRYkpPTGJibGVtZk84aHgtb2w1UG1POFV2MEpvcnMwS1Y4V2VCdnNJb0dyOFpWbDk2clllYUNIeUR4eDU2R0tuUnJQTzRtNF9qOEI5Ny1iVldqX2VFMkdWdjRERW9YbDBNNGJlOWMzX2c0Slc2Wmcw0gGyAUFVX3lxTFBHaFNyT2llVDZwenNVSmx3NGp3WVVaWklIYnlHQk4zVmYwT3lvMFlXQlVrVlFZTEpCaTN2dDVndG45ajBLMHNrWlp0VWxzX1U1QUZJS2RrcXluTktQdVlMdTdhUU9ENk5tWmhXRzcycGQzYUIzZ3dEbnZ1cXRlaVVidWhBc2J1b3R2UVB0cndTTUJreG10aURoMDl4OVpyVTVpekdTTFFuNTU0aFNzNzBYUWc?oc=5,2026-03,March,13,"Assam polls: PM Modi bats for NDA, says state ready for five more years - The Assam Tribune Assam polls: PM Modi bats for NDA, says state ready for five more years The Assam Tribune",assam poll bat ready five year assam tribune assam poll bat ready five year assam tribune,16,4,Topic 5: address / march / assam,0.13895880248601744,0.0,0.0,0.0,0.03444939891470211,0.13895880248601744,0.0,0.0
Modi,"Noida International Airport will create opportunities for farmers, traders and youth in UP: PM Narendra Modi - India TV News","Noida International Airport will create opportunities for farmers, traders and youth in UP: PM Narendra Modi India TV News",,India TV News,2026-03-28 08:00:00,,https://news.google.com/rss/articles/CBMiywFBVV95cUxPbjVJWHBic1BfVzkzcDE4T0dfSGJOd2swR1ZkRXppTE5MdHgydExnSmR2bXlKTUlHYmJ3YVEycXpUcTZ4TmF0OEs4NThKTURkaENKYy1Bc1FhVWxST25yTHlaRWktanJvYjBYU3lZeXNNYmxZWXc2SS1FSXpjcG5LVy1WSWd0bmJyYTJsdk1OcGQ1ZmxadWhHRHNlQ1JSSGN0ektlOVFaWWNwanNHaFQ3MzQ5dGpLMzVwUnlyYUtFWjVwNUx1Tk1rRExWMNIB0AFBVV95cUxQTEVfbHhFbV9tX0xoX1I4QUhaZF9PLUJ0emROREd6Ni1fdklCVUpWYnJ3UVN4aGRZdGtNa1lLemstamhpbXc4clNQazY4Z2V1X2JucHhvTWZxTy05aDJqNGRCT0lITTZ5OGxOckxlRDd3ZUEta1RTTnRfbDlFMGJiRlh2ODA1WTJ2T0tHb2VId1VPaXhxbGlzRHVNSGx6ZUEyWWpkZm5lUURYUmFaX0lSNW9sM1JhUjFmX3RwU3NjNjdfMTFYTWwwbEd5ZGIxSS0x?oc=5,2026-03,March,13,"Noida International Airport will create opportunities for farmers, traders and youth in UP: PM Narendra Modi - India TV News Noida International Airport will create opportunities for farmers, traders and youth in UP: PM Narendra Modi India TV News",noida international airport create opportunity farmer trader youth noida international airport create opportunity farmer trader youth,16,5,Topic 6: com / speech / call,0.034920073290368704,0.009028918516483448,0.0,0.0,0.007571888438240088,0.014029595031242495,0.034920073290368704,0.0
